name,price,num_reviews,per_cnt_price,url
"Disposable Face Mask, Breathable Masks (Pack of 50)",28.99,151,($0.58/Count),https://amazon.com//gp/slredirect/picassoRedirect.html/ref=pa_sp_atf_aps_sr_pg1_1?ie=UTF8&adId=A00897123VBVNB8BN425U&url=%2FDisposable-Face-Mask-Breathable-Masks%2Fdp%2FB089HW9VSV%2Fref%3Dsr_1_1_sspa%3Fdchild%3D1%26keywords%3DMasks%26qid%3D1594605010%26sr%3D8-1-spons%26psc%3D1&qualifier=1594605010&id=8087021197311779&widgetName=sp_atf
"Face Masks, 50 Units/Box",29.99,4,-,https://amazon.com//gp/slredirect/picassoRedirect.html/ref=pa_sp_atf_aps_sr_pg1_1?ie=UTF8&adId=A07383922UB4GECVH78OY&url=%2FFace-Masks-50-Units-Box%2Fdp%2FB089YWSLKB%2Fref%3Dsr_1_2_sspa%3Fdchild%3D1%26keywords%3DMasks%26qid%3D1594605010%26sr%3D8-2-spons%26psc%3D1&qualifier=1594605010&id=8087021197311779&widgetName=sp_atf
Face Masks - 50 Pack - Comfortable to wear,34.99,3,($0.70/Count),https://amazon.com//gp/slredirect/picassoRedirect.html/ref=pa_sp_atf_aps_sr_pg1_1?ie=UTF8&adId=A00136492CGEB58GVPTVX&url=%2FFace-Masks-Pack-Comfortable-wear%2Fdp%2FB089GV9LTX%2Fref%3Dsr_1_3_sspa%3Fdchild%3D1%26keywords%3DMasks%26qid%3D1594605010%26sr%3D8-3-spons%26psc%3D1&qualifier=1594605010&id=8087021197311779&widgetName=sp_atf
Personal Outdoor Face Mouth Masks - 50 Pack/Box,33.99,4,-,https://amazon.com//gp/slredirect/picassoRedirect.html/ref=pa_sp_atf_aps_sr_pg1_1?ie=UTF8&adId=A09206751C84QLN0806CY&url=%2FPersonal-Outdoor-Face-Mouth-Masks%2Fdp%2FB089LQT6X3%2Fref%3Dsr_1_4_sspa%3Fdchild%3D1%26keywords%3DMasks%26qid%3D1594605010%26sr%3D8-4-spons%26psc%3D1&qualifier=1594605010&id=8087021197311779&widgetName=sp_atf
Purism KN95 (20 Masks per Box),40.00,7,-,https://amazon.com//Purism-KN95-20-Masks-Box/dp/B085BNBZDR/ref=sr_1_5?dchild=1&keywords=Masks&qid=1594605010&sr=8-5
"KN95 Face Mask, Pack of 5",20.00,13,($4.00/Item),https://amazon.com//KN95-Face-Mask-Pack-5/dp/B086JBZXPT/ref=sr_1_6?dchild=1&keywords=Masks&qid=1594605010&sr=8-6
"SupplyAID RRS-KN95-5PK KN95 Mask, Protection Against PM2.5 Dust. Pollen and Haze-Proof, 5 Pack",17.98,64,($3.60/Count),https://amazon.com//SupplyAID-RRS-KN95-5PK-Protection-Against-Haze-Proof/dp/B086JD7TKZ/ref=sr_1_7?dchild=1&keywords=Masks&qid=1594605010&sr=8-7
"KN95 Face Mask, Pack of 10",35.55,2,($3.56/Item),https://amazon.com//KN95-Face-Mask-Pack-10/dp/B086JTS3D8/ref=sr_1_8?dchild=1&keywords=Masks&qid=1594605010&sr=8-8
"Feradyne KN95 Mask PPE5012 GB 2626-2006, pack of 10 mask",31.27,0,($3.13/Item),https://amazon.com//Feradyne-KN95-Mask-PPE5012-2626-2006/dp/B086R883Q8/ref=sr_1_9?dchild=1&keywords=Masks&qid=1594605010&sr=8-9
"KN95 Face Mask, GB2626-2006, Pack of 20",62.99,37,($3.15/Item),https://amazon.com//KN95-Face-Mask-GB2626-2006-Pack/dp/B087RJ9JCF/ref=sr_1_10?dchild=1&keywords=Masks&qid=1594605010&sr=8-10
"KN95 Mask - Non-NIOSH Approved Respirator, pack of 50",132.15,1,($2.64/Item),https://amazon.com//M%C3%A1scara-KN95-Respirador-aprobado-paquete/dp/B086W7BKZZ/ref=sr_1_11?dchild=1&keywords=Masks&qid=1594605010&sr=8-11
Kids Single Use Disposable Face Mask (Pack of 50),30.37,19,-,https://amazon.com//Kids-Single-Disposable-Face-Solid/dp/B087Z8GB88/ref=sr_1_12?dchild=1&keywords=Masks&qid=1594605010&sr=8-12
"Wembley Unisex Laboratory-Tested Adjustable and Washable Silver Linings Face Mask with 10- Replaceable Filters, Beige, One Size",19.99,14,-,https://amazon.com//Wembley-Laboratory-Tested-Adjustable-Washable-Replaceable/dp/B0892SKYXV/ref=sr_1_13?dchild=1&keywords=Masks&qid=1594605010&sr=8-13
"Face Mask, Pack of 50",29.99,"12,189",($0.60/Item),https://amazon.com//Face-Mask-Pack-of-50/dp/B086KMYNSS/ref=sr_1_14?dchild=1&keywords=Masks&qid=1594605010&sr=8-14
Modenna Face Mask Disposable Blue 50Pcs,19.99,"3,472",($0.40/Count),https://amazon.com//Modenna-Face-Mask-Disposable-50Pcs/dp/B086HKN7SS/ref=sr_1_15?dchild=1&keywords=Masks&qid=1594605010&sr=8-15
"5 Pack Fashion Protective, Reusable Cotton Fabric, Unisex Black Cotton, Washable",23.80,638,($4.76/Count),https://amazon.com//Fashion-Protective-Reusable-Cotton-Washable/dp/B087LXGQW6/ref=sr_1_16?dchild=1&keywords=Masks&qid=1594605010&sr=8-16
"Disposable Masks, AXHKIO Disposable Breathable 3 Ply Mask, with Elastic Earloops (50 Pcs)",25.99,37,($0.52/Count),https://amazon.com//Disposable-AXHKIO-Breathable-Elastic-Earloops/dp/B0897QFZ1R/ref=sr_1_17?dchild=1&keywords=Masks&qid=1594605010&sr=8-17
"Face Mask, Pack of 50",29.99,"2,180",($0.60/Item),https://amazon.com//Face-Mask-Pack-of-50/dp/B086JBF8F3/ref=sr_1_18?dchild=1&keywords=Masks&qid=1594605010&sr=8-18
Bigox Face Mask Disposable Earloop Blue 50Pcs,19.99,772,($0.40/Count),https://amazon.com//Bigox-Face-Disposable-Earloop-50Pcs/dp/B087RRWGJB/ref=sr_1_19?dchild=1&keywords=Masks&qid=1594605010&sr=8-19
iHeartRaves Seamless Face Cover Mouth Mask Scarf Bandanas Neck Gaiter - Dust & UV Sun-Protection for Festivals and Outdoors,12.95,162,-,https://amazon.com//iHeartRaves-M%C3%A1scara-costuras-protecci%C3%B3n-festivales/dp/B07B6963P6/ref=sr_1_20?dchild=1&keywords=Masks&qid=1594605010&sr=8-20
"5 Pack Fashion Protective, Unisex Black Dust Cotton, Washable, Reusable Cotton Fabric",21.99,179,($4.40/Count),https://amazon.com//gp/slredirect/picassoRedirect.html/ref=pa_sp_mtf_aps_sr_pg1_1?ie=UTF8&adId=A01669891PZM671RW95FV&url=%2FFashion-Protective-Unisex-Washable-Reusable%2Fdp%2FB089R31T4K%2Fref%3Dsr_1_21_sspa%3Fdchild%3D1%26keywords%3DMasks%26qid%3D1594605010%26sr%3D8-21-spons%26psc%3D1%26smid%3DA1YUY7TPUWYUBD&qualifier=1594605010&id=8087021197311779&widgetName=sp_mtf
"Face Masks, Pack of 50, Comfortable to wear, Adult",27.99,3,($0.56/Count),https://amazon.com//gp/slredirect/picassoRedirect.html/ref=pa_sp_mtf_aps_sr_pg1_1?ie=UTF8&adId=A08186131EI4O72HARKGZ&url=%2FFace-Masks-Pack-Comfortable-Adult%2Fdp%2FB08BF78VR3%2Fref%3Dsr_1_22_sspa%3Fdchild%3D1%26keywords%3DMasks%26qid%3D1594605010%26sr%3D8-22-spons%26psc%3D1&qualifier=1594605010&id=8087021197311779&widgetName=sp_mtf
"Face Mask Disposable Masks 100 pieces With 10 Bonus Wipes - Breathable, 3-Ply, Non-Medical bulk Masks (100 pack)",37.99,0,($0.38/Count),https://amazon.com//gp/slredirect/picassoRedirect.html/ref=pa_sp_mtf_aps_sr_pg1_1?ie=UTF8&adId=A04228713OIJ56VWN8S1&url=%2FDisposable-Masks-pieces-Bonus-Wipes%2Fdp%2FB08C6CQP28%2Fref%3Dsr_1_23_sspa%3Fdchild%3D1%26keywords%3DMasks%26qid%3D1594605010%26sr%3D8-23-spons%26psc%3D1&qualifier=1594605010&id=8087021197311779&widgetName=sp_mtf
"5 Pack Fashion Protective, Unisex Black Dust Cotton, Reusable Cotton Fabric",22.99,2,-,https://amazon.com//gp/slredirect/picassoRedirect.html/ref=pa_sp_mtf_aps_sr_pg1_1?ie=UTF8&adId=A05359333IIPNYA16YJZ1&url=%2FFashion-Protective-Unisex-Cotton-Reusable%2Fdp%2FB089SNTQPH%2Fref%3Dsr_1_24_sspa%3Fdchild%3D1%26keywords%3DMasks%26qid%3D1594605010%26sr%3D8-24-spons%26psc%3D1&qualifier=1594605010&id=8087021197311779&widgetName=sp_mtf
"5 Pack Fashion Protective, Unisex Black Dust Cotton, Reusable Cotton Fabric",19.88,379,($3.98/Count),https://amazon.com//Fashion-Protective-Unisex-Cotton-Reusable/dp/B088K63VYJ/ref=sr_1_25?dchild=1&keywords=Masks&qid=1594605010&sr=8-25
"3ply Disposable Face Mask, 50 Count",29.99,252,($0.60/Count),https://amazon.com//3ply-Disposable-Face-Mask-Count/dp/B08852WYM2/ref=sr_1_26?dchild=1&keywords=Masks&qid=1594605010&sr=8-26
"Disposable Face Mask, Pack of 50, New Packaging",29.99,170,($0.60/Item),https://amazon.com//Mascarilla-facial-50-unidades/dp/B088GKG1RN/ref=sr_1_27?dchild=1&keywords=Masks&qid=1594605010&sr=8-27
"Face Mask, Pack of 50",29.99,526,($0.60/Item),https://amazon.com//Face-Mask-Pack-of-50/dp/B086RP7G38/ref=sr_1_28?dchild=1&keywords=Masks&qid=1594605010&sr=8-28
50 Pcs Disposable Face Masks 3 Ply Protection Safety Mask for Dust Air Pollution Personal Protective Mouth Cover for Facial Prevention Earloop Masks Bulk Blue Indoor and Outdoor Use,25.99,564,($0.52/Count),https://amazon.com//Disposable-Protection-Pollution-Protective-Prevention/dp/B086HMXMH9/ref=sr_1_29?dchild=1&keywords=Masks&qid=1594605010&sr=8-29
"50pcs Disposable Face Mask, Facial Masks, Mouth Masks 3-Ply with Elastic Earloops, Breathable Non-woven Mouth Filter Covers for Home, Office, Outdoor - Blue",22.98,254,-,https://amazon.com//mask50/dp/B087YVJXNL/ref=sr_1_30?dchild=1&keywords=Masks&qid=1594605010&sr=8-30
"Single Use Disposable Face Mask (Pack of 50), Blue",29.99,884,($0.60/Item),https://amazon.com//Single-Disposable-Face-Mask-Pack/dp/B086T638CS/ref=sr_1_31?dchild=1&keywords=Masks&qid=1594605010&sr=8-31
Reusable Cotton Face Mask (Pack of 50),30.99,"1,303",-,https://amazon.com//Reusable-Cotton-Face-Mask-Pack/dp/B086WC1LDD/ref=sr_1_32?dchild=1&keywords=Masks&qid=1594605010&sr=8-32
INTO THE AM Seamless Face Cover Mouth Mask Scarf Bandanas Neck Gaiter - Dust & UV Sun-Protection for Festivals and Outdoors,12.95,244,-,https://amazon.com//INTO-AM-Matter-Seamless-Bandana/dp/B07B67XGS7/ref=sr_1_33?dchild=1&keywords=Masks&qid=1594605010&sr=8-33
"MSAAEX Disposable Face Mask for Air Pollution, Dustproof Mouth Cover, 3-ply Safety Mask (50)",19.88,231,($0.40/Count),https://amazon.com//MSAAEX-Disposable-Pollution-Dustproof-Safety/dp/B087X9RZTD/ref=sr_1_34?dchild=1&keywords=Masks&qid=1594605010&sr=8-34
Disposable Face Mask - Pack of 50 - Blue,28.65,427,($0.57/Item),https://amazon.com//M%C3%A1scara-facial-desechable-unidades-color/dp/B086MPXGKJ/ref=sr_1_35?dchild=1&keywords=Masks&qid=1594605010&sr=8-35
Gildan Reusable Adult Tie-On Triple Layer Mask (Pack of 48),39.99,281,-,https://amazon.com//Gildan-Reusable-Adult-Triple-Layer/dp/B086QS2YHF/ref=sr_1_36?dchild=1&keywords=Masks&qid=1594605010&sr=8-36
Unisex Washable and Reusable Cotton Warm Face Protection for Outdoor,12.99,292,($6.50/Count),https://amazon.com//Unisex-Washable-Reusable-Protection-Outdoor/dp/B088FVJTXG/ref=sr_1_37?dchild=1&keywords=Masks&qid=1594605010&sr=8-37
Quality Durables Adults and Kids 4-Pack Reusable Face Covering,18.00,396,-,https://amazon.com//Quality-Durables-Reusable-Covering-Heather/dp/B088BWP7VH/ref=sr_1_38?dchild=1&keywords=Masks&qid=1594605010&sr=8-38
"TomrickCare Face Masks, 3-Ply Breathable Masks 5 sets of 10 per Box,  Comfortable Earloops(50 Pack)",27.31,129,($0.55/Count),https://amazon.com//TomrickCare-Masks-Breathable-Comfortable-Earloops/dp/B0892T3YLS/ref=sr_1_39?dchild=1&keywords=Masks&qid=1594605010&sr=8-39
"Disposable Face Mask, Pack of 50",29.99,210,($0.60/Item),https://amazon.com//Disposable-Face-Mask-Pack-50/dp/B0877TJL3M/ref=sr_1_40?dchild=1&keywords=Masks&qid=1594605010&sr=8-40
"Disposable Face Mask, ESOLOM 3-Ply Facial Cover Masks with Ear Loop, Breathable Non-Woven Mouth Cover for Personal, Suitable for Home, Office, Outdoor- 50 PCS",24.99,386,($0.50/Count),https://amazon.com//Disposable-ESOLOM-Breathable-Non-Woven-Personal/dp/B086QLH269/ref=sr_1_41?dchild=1&keywords=Masks&qid=1594605010&sr=8-41
"Fruit of the Loom Reusable Cotton Face Mask (Packs of 50, 100, and 250)",53.75,103,-,https://amazon.com//Fruit-Loom-Reusable-Cotton-Face-Mask/dp/B086ZHZY6T/ref=sr_1_42?dchild=1&keywords=Masks&qid=1594605010&sr=8-42
ZUBREX Disposable 3 Ply Safety Face Mask for Protection - with Nanofiber Filter Lining - and Elastic Earloops - 50 Pcs (Blue),29.99,446,More Buying Choices,https://amazon.com//ZUBREX-Disposable-Safety-Face-Protection/dp/B088BY7YPX/ref=sr_1_43?dchild=1&keywords=Masks&qid=1594605010&sr=8-43
SUNCOO Disposable Face Mask Dust Particle 3-Layer Design Mask with Earloops - 50 Pack,23.99,"1,006",More Buying Choices,https://amazon.com//SUNCOO-Disposable-Particle-3-Layer-Earloops/dp/B0868YY9MW/ref=sr_1_44?dchild=1&keywords=Masks&qid=1594605010&sr=8-44
"Sfavereak 50pcs Disposable Face Mask 3 Layers Safety Masks With Elastic Ear Loop Comfortable for Blocking Dust Air Pollution Protection, 1count",19.99,423,More Buying Choices,https://amazon.com//Sfavereak-Disposable-Comfortable-Pollution-Protection/dp/B08725VTGK/ref=sr_1_45?dchild=1&keywords=Masks&qid=1594605010&sr=8-45
"Levi's Men's 100% Cotton Multi-Purpose Bandana Gift Sets – Headband, Wrap, Protective Coverage",15.85,"3,099",-,https://amazon.com//Levis-Bandanas-Gift-White-Black/dp/B0765YZMZ6/ref=sr_1_46?dchild=1&keywords=Masks&qid=1594605010&sr=8-46
3pcs/Pack Dust Masks Breathable Reusable for Outdoor Sport Half Face Earloop Masks Dust Pollen Cotton Black Masks (Black),14.99,218,($5.00/Count),https://amazon.com//Breathable-Reusable-Outdoor-Earloop-Pollen/dp/B086R5TCNK/ref=sr_1_47?dchild=1&keywords=Masks&qid=1594605010&sr=8-47
"Face Mask, Eventronic Face Mask Cover, Disposable Mask, Comfortable and Breathable.(50 PCS, Blue)",19.99,213,More Buying Choices,https://amazon.com//Eventronic-Cover-Disposable-Comfortable-Breathable/dp/B086BL73FP/ref=sr_1_48?dchild=1&keywords=Masks&qid=1594605010&sr=8-48
"CKW 3 Ply Disposable Protective Mask, 50 Masks in Box, Blue, 19x10x8.8cm",28.90,599,($0.58/Count),https://amazon.com//CKW-Disposable-Protective-Masks-19x10x8-8cm/dp/B086Y21B7Z/ref=sr_1_49?dchild=1&keywords=Masks&qid=1594605010&sr=8-49
TODOLOR Face Mask 3-Layer Protective Earloop Blue 50Pcs,19.99,167,($0.40/Count),https://amazon.com//TODOLOR-3-Layer-Protective-Earloop-50Pcs/dp/B087Z5BD9H/ref=sr_1_50?dchild=1&keywords=Masks&qid=1594605010&sr=8-50
Reusable Face Cover (Pack of 3),16.04,743,($5.35/Item),https://amazon.com//Reusable-Face-Cover-Pack-3/dp/B086ZMN1N3/ref=sr_1_51?dchild=1&keywords=Masks&qid=1594605010&sr=8-51
"Tart Collections Reversible and Adjustable Face Mask, Comfortable, Soft Elastic Ear Loops, Washable and Reusable, Unisex, 95% Poly / 5% Spandex, Black/White Dot",9.99,6,-,https://amazon.com//Tart-Collections-Reversible-Adjustable-Comfortable/dp/B08972D7W9/ref=sr_1_52?dchild=1&keywords=Masks&qid=1594605010&sr=8-52
Fashion Mouth Protection Unisex Washable and Reusable Cotton Warm Face Protection with Adjustable Bridge Design (3-Pack Black),15.69,"1,549",($5.23/Count),https://amazon.com//Fashion-Protection-Washable-Reusable-Adjustable/dp/B0855PDTYG/ref=sr_1_53?dchild=1&keywords=Masks&qid=1594605010&sr=8-53
"Dust mask with Filter,Sports Face Mask, 4 Filters and 2 Valves Included,Men's and Women's Universal Masks,Suitable for Woodworking, Outdoor Activities",25.99,19,($30.94/100 g),https://amazon.com//Included-Universal-Suitable-Woodworking-Activities/dp/B08738MMY9/ref=sr_1_54?dchild=1&keywords=Masks&qid=1594605010&sr=8-54
"Disposable Face Masks, 3 Layers Breathable and Comfortable Elastic Ear Loop, Pack of 50 PCS",29.99,213,($0.60/Count),https://amazon.com//Disposable-Layers-Breathable-Comfortable-Elastic/dp/B088M6YFDJ/ref=sr_1_55?dchild=1&keywords=Masks&qid=1594605010&sr=8-55
"5 Pcs Unisex Black Dust Cotton, Washable, Reusable Cotton Fabric",19.98,81,($4.00/Count),https://amazon.com//Unisex-Cotton-Washable-Reusable-Fabric/dp/B0882S61Y9/ref=sr_1_56?dchild=1&keywords=Masks&qid=1594605010&sr=8-56
"Pure Cotton Reusable Face Mask - Protective Fabric Face Cover 3 Piece Set, Washable & Breathable Mouth Mask (Black,White,Blue)",11.99,56,($4.00/Count),https://amazon.com//gp/slredirect/picassoRedirect.html/ref=pa_sp_btf_aps_sr_pg1_1?ie=UTF8&adId=A1024196200P6GEZBRL6W&url=%2FPure-Cotton-Reusable-Face-Mask%2Fdp%2FB088THXCXJ%2Fref%3Dsr_1_57_sspa%3Fdchild%3D1%26keywords%3DMasks%26qid%3D1594605010%26sr%3D8-57-spons%26psc%3D1&qualifier=1594605010&id=8087021197311779&widgetName=sp_btf
"3 PCS Washable Reusable 2 Layers Breathable Face Madks Facial M_ask C-over, BGB",22.99,7,-,https://amazon.com//gp/slredirect/picassoRedirect.html/ref=pa_sp_btf_aps_sr_pg1_1?ie=UTF8&adId=A02905611ZYA5V0JFK34E&url=%2FWashable-Reusable-Layers-Breathable-Facial%2Fdp%2FB089GQT2GN%2Fref%3Dsr_1_58_sspa%3Fdchild%3D1%26keywords%3DMasks%26qid%3D1594605010%26sr%3D8-58-spons%26psc%3D1&qualifier=1594605010&id=8087021197311779&widgetName=sp_btf
3-Layer Protection Face Masks(50 Pieces/Box),29.99,3,-,https://amazon.com//gp/slredirect/picassoRedirect.html/ref=pa_sp_btf_aps_sr_pg1_1?ie=UTF8&adId=A10118331EGHUWQO7S1JK&url=%2F3-Layer-Protection-Face-Masks-Pieces%2Fdp%2FB089YVFRXW%2Fref%3Dsr_1_59_sspa%3Fdchild%3D1%26keywords%3DMasks%26qid%3D1594605010%26sr%3D8-59-spons%26psc%3D1&qualifier=1594605010&id=8087021197311779&widgetName=sp_btf
"Face Masks, 50 Pack, Comfortable to Wear",29.98,13,($0.60/Count),https://amazon.com//gp/slredirect/picassoRedirect.html/ref=pa_sp_btf_aps_sr_pg1_1?ie=UTF8&adId=A07924297P25AD40OZ7C&url=%2FFace-Masks-Pack-Comfortable-Wear%2Fdp%2FB0894R6TB6%2Fref%3Dsr_1_60_sspa%3Fdchild%3D1%26keywords%3DMasks%26qid%3D1594605010%26sr%3D8-60-spons%26psc%3D1&qualifier=1594605010&id=8087021197311779&widgetName=sp_btf
"Face Masks, Pack of 50",24.99,4,-,https://amazon.com//gp/slredirect/picassoRedirect.html/ref=pa_sp_atf_next_aps_sr_pg2_1?ie=UTF8&adId=A033729131FVC1QTU93D8&url=%2FFace-Masks-Pack-of-50%2Fdp%2FB089YW82BX%2Fref%3Dsr_1_49_sspa%3Fdchild%3D1%26keywords%3DMasks%26qid%3D1594605010%26sr%3D8-49-spons%26psc%3D1&qualifier=1594605015&id=8452762377862746&widgetName=sp_atf_next
"Designer Cotton Reusable Face Mask - Protective Fabric Face Cover Piece Set, Washable & Breathable Mouth Mask (4)",22.99,0,($5.75/Item),https://amazon.com//gp/slredirect/picassoRedirect.html/ref=pa_sp_atf_next_aps_sr_pg2_1?ie=UTF8&adId=A01977693TMZCVWOA9CZJ&url=%2FDesigner-Cotton-Reusable-Face-Mask%2Fdp%2FB08BJFZMPP%2Fref%3Dsr_1_50_sspa%3Fdchild%3D1%26keywords%3DMasks%26qid%3D1594605010%26sr%3D8-50-spons%26psc%3D1&qualifier=1594605015&id=8452762377862746&widgetName=sp_atf_next
"Disposable Face Mask, ESOLOM 3-Ply Facial Cover Masks with Ear Loop, Breathable Non-Woven Mouth Cover for Personal, Suitable for Home, Office, Outdoor- 50 PCS",24.99,386,($0.50/Count),https://amazon.com//gp/slredirect/picassoRedirect.html/ref=pa_sp_atf_next_aps_sr_pg2_1?ie=UTF8&adId=A0904854ULFH0MJ7TEH7&url=%2FDisposable-ESOLOM-Breathable-Non-Woven-Personal%2Fdp%2FB086QLH269%2Fref%3Dsr_1_51_sspa%3Fdchild%3D1%26keywords%3DMasks%26qid%3D1594605010%26sr%3D8-51-spons%26psc%3D1&qualifier=1594605015&id=8452762377862746&widgetName=sp_atf_next
"MAGID Disposable Face Masks with Soft Elastic Earloops & an Adjustable Nose Clip, Triple-Layer (3-Ply) Construction, Non-Woven Material, Blue (50 Masks)",23.00,56,($0.46/Piece),https://amazon.com//gp/slredirect/picassoRedirect.html/ref=pa_sp_atf_next_aps_sr_pg2_1?ie=UTF8&adId=A03098012AHOIJNJYD9ZZ&url=%2FDisposable-Adjustable-Triple-Layer-Construction-Non-Woven%2Fdp%2FB0891JHCTB%2Fref%3Dsr_1_52_sspa%3Fdchild%3D1%26keywords%3DMasks%26qid%3D1594605010%26sr%3D8-52-spons%26psc%3D1&qualifier=1594605015&id=8452762377862746&widgetName=sp_atf_next
Wecolor 100 Pack 3 Ply Disposable Face Masks (Blue),42.99,"1,963",($42.99/Count),https://amazon.com//Disposable-Hypoallergenic-Breathability-Comfort-Great-Allergies/dp/B078718WVB/ref=sr_1_53?dchild=1&keywords=Masks&qid=1594605010&sr=8-53
"TOOCA Disposable Earloop Face Mask, Pack of 50,3-ply Mouth Mask",24.99,7,-,https://amazon.com//TOOCA-Disposable-Earloop-3-ply-Mouth/dp/B089LZRGJ4/ref=sr_1_54?dchild=1&keywords=Masks&qid=1594605010&sr=8-54
"5 Pack Fashion Protective, Unisex Black Dust Cotton, Washable, Reusable Cotton Fabric",18.99,858,($3.80/Count),https://amazon.com//Fashion-Protective-Unisex-Washable-Reusable/dp/B087NMTT81/ref=sr_1_55?dchild=1&keywords=Masks&qid=1594605010&sr=8-55
"3 Pack Face Covering, Mouth Covering Unisex Black Dust Cotton, Washable, Reusable Cotton Fabric Dust Covering",14.99,250,-,https://amazon.com//Covering-Unisex-Cotton-Washable-Reusable/dp/B089148BWQ/ref=sr_1_56?dchild=1&keywords=Masks&qid=1594605010&sr=8-56
INTO THE AM Seamless Face Cover Bandanas Neck Gaiter Mouth Mask Scarf - Dust & UV Sun-Protection for Festivals and Outdoors,12.95,194,-,https://amazon.com//INTO-AM-Black-Seamless-Bandana/dp/B0754T83QC/ref=sr_1_57?dchild=1&keywords=Masks&qid=1594605010&sr=8-57
"WQFXYZ 6 Packs of 3 Colors for Outdoor Protection, Filtering Measures, dust and Deodorization, Cycling Protection, Fashion Unisex",25.99,1,-,https://amazon.com//gp/slredirect/picassoRedirect.html/ref=pa_sp_atf_next_aps_sr_pg4_1?ie=UTF8&adId=A09087883R526BS06NP7F&url=%2FWQFXYZ-Protection-Filtering-Measures-Deodorization%2Fdp%2FB08BXGBC6D%2Fref%3Dsr_1_145_sspa%3Fdchild%3D1%26keywords%3DMasks%26qid%3D1594605017%26sr%3D8-145-spons%26psc%3D1&qualifier=1594605018&id=1319490864530914&widgetName=sp_atf_next
"Unisex Black Cloth Face Madks Packs Reusable Washable, Breathable Dust Fashion Protective Fabric for Men Women, 2 Pcs Black",14.99,1,-,https://amazon.com//gp/slredirect/picassoRedirect.html/ref=pa_sp_atf_next_aps_sr_pg4_1?ie=UTF8&adId=A06266301NH39MHSHE51C&url=%2FReusable-Washable-Breathable-Fashion-Protective%2Fdp%2FB08BC7KM5M%2Fref%3Dsr_1_146_sspa%3Fdchild%3D1%26keywords%3DMasks%26qid%3D1594605017%26sr%3D8-146-spons%26psc%3D1&qualifier=1594605018&id=1319490864530914&widgetName=sp_atf_next
"Disposable Face Masks, Daily Protective Mask for Face with Knitted Ear-Loops 50 Pcs (White)",28.99,3,-,https://amazon.com//gp/slredirect/picassoRedirect.html/ref=pa_sp_atf_next_aps_sr_pg4_1?ie=UTF8&adId=A02688782C2TBS63KTZE1&url=%2FDisposable-Masks-Protective-Knitted-Ear-Loops%2Fdp%2FB089VZLMSY%2Fref%3Dsr_1_147_sspa%3Fdchild%3D1%26keywords%3DMasks%26qid%3D1594605017%26sr%3D8-147-spons%26psc%3D1&qualifier=1594605018&id=1319490864530914&widgetName=sp_atf_next
"[10 pack] TomrickCare Face Masks, General Use 3-Ply Masks",11.99,20,($1.20/Count),https://amazon.com//gp/slredirect/picassoRedirect.html/ref=pa_sp_atf_next_aps_sr_pg4_1?ie=UTF8&adId=A0425779IZ35W8HQNAFQ&url=%2Fpack-TomrickCare-Masks-General-3-Ply%2Fdp%2FB0892W18KH%2Fref%3Dsr_1_148_sspa%3Fdchild%3D1%26keywords%3DMasks%26qid%3D1594605017%26sr%3D8-148-spons%26psc%3D1&qualifier=1594605018&id=1319490864530914&widgetName=sp_atf_next
BROAD AirPro Mask Rechargeable Electrical Air Purifying Respirator with HEPA Filter,65.99,28,-,https://amazon.com//AirPro-Mascarilla-recargable-el%C3%A9ctrico-purificador/dp/B086Z2B2F8/ref=sr_1_149?dchild=1&keywords=Masks&qid=1594605017&sr=8-149
30 PCS Adult PM2.5 Activated Carbon Filter 5 Layers Replaceable Anti Haze Filter Paper,21.95,114,More Buying Choices,https://amazon.com//Activated-Carbon-Filter-Layers-Replaceable/dp/B087D1KY66/ref=sr_1_150?dchild=1&keywords=Masks&qid=1594605017&sr=8-150
"Lanier Wellness Kids 2-Layer Reusable Face Cover (Pack of 2), Blue/White",13.42,171,-,https://amazon.com//Lanier-Wellness-2-Layer-Reusable-Cover/dp/B087ZJV6DB/ref=sr_1_151?dchild=1&keywords=Masks&qid=1594605017&sr=8-151
Perfect Stix 3 Ply White Mask White Color,28.90,4,($5.78/10 Items),https://amazon.com//Perfect-Stix-White-Mask-Color/dp/B088MW473P/ref=sr_1_152?dchild=1&keywords=Masks&qid=1594605017&sr=8-152
"Disposable Face Masks, 3 Ply, Comfortable, Blue, Available in Multi-Packs, Qty 10-1,000 by Fastest Mask (10 Masks)",5.18,4,($5.18/Count),https://amazon.com//Disposable-Comfortable-Multi-Packs-Fastest-Mask/dp/B089VRGY6X/ref=sr_1_153?dchild=1&keywords=Masks&qid=1594605017&sr=8-153
"OxGord Face Mask - 500 Disposable Ear-Loop Masks (50ct Per Box, Pack of 10) Protection from Dust, Pollen, and More – Mouth Cover Ideal for Everyday Use, Blue",130.00,7,($0.26/Item),https://amazon.com//OxGord-Face-Mask-Disposable-Protection/dp/B0887YZSBR/ref=sr_1_154?dchild=1&keywords=Masks&qid=1594605017&sr=8-154
O'NEILL Fashion Face Mask Black One Size,10.95,0,-,https://amazon.com//ONEILL-Fashion-Face-Mask-Black/dp/B08B4LVJ5Y/ref=sr_1_155?dchild=1&keywords=Masks&qid=1594605017&sr=8-155
Designer Face Masks for women men kids with filter pack of 2 Plaid Cartoon Floral Stylish Cute Kawaii fashion washable face masks for dust protection cloth mask,18.99,76,-,https://amazon.com//Designer-Cartoon-Stylish-washable-protection/dp/B088H5ZCL2/ref=sr_1_156?dchild=1&keywords=Masks&qid=1594605017&sr=8-156
"[6 Pack] Unisex Sun UV Protection Face Bandana, Reusable Motorcycle Half Mask Scarf Neck Gaiter Balaclava for Men Women",29.99,330,-,https://amazon.com//Protection-Reusable-Motorcycle-Breathable-Balaclava/dp/B087FRV2LB/ref=sr_1_157?dchild=1&keywords=Masks&qid=1594605017&sr=8-157
FAYBOX 6pcs Magic Wide Wicking Headbands Outdoor Headwear Bandana Sports Scarf Tube UV Face Mask for Workout Yoga Running Hiking Riding Motorcycling,15.90,"2,051",-,https://amazon.com//FAYBOX-Wicking-Headbands-Outdoor-Headwear/dp/B077SQV1FX/ref=sr_1_158?dchild=1&keywords=Masks&qid=1594605017&sr=8-158
"3 Pack Unisex Face Covering, Black Dust Cotton, Washable, Reusable Cotton Fabric【US in Stock】",16.99,113,($5.66/Count),https://amazon.com//Unisex-Covering-Washable-Reusable-Fabric%E3%80%90US/dp/B088DJ86QH/ref=sr_1_159?dchild=1&keywords=Masks&qid=1594605017&sr=8-159
Milcoast 3-Ply Layer Disposable Earloop Face Masks - 50 Pack,34.99,451,More Buying Choices,https://amazon.com//Milcoast-3-Ply-Layer-Disposable-Earloop/dp/B087CBWDZ2/ref=sr_1_160?dchild=1&keywords=Masks&qid=1594605017&sr=8-160
"Achiou Neck Gaiter Face Scarf Mask-Dust, Sun Protection Cool Lightweight Windproof, Breathable Fishing Hiking Running Cycling",12.95,"2,705",-,https://amazon.com//Achiou-Mask-Dust-Protection-Lightweight-Breathable/dp/B07T4V86LW/ref=sr_1_161?dchild=1&keywords=Masks&qid=1594605017&sr=8-161
"Cotton Fabric Cloth Washable Reusable Face Macks, Pack 2_Assorted Color_D",24.99,12,-,https://amazon.com//Cotton-Washable-Reusable-2_Assorted-Color_D/dp/B089KGLRHQ/ref=sr_1_162?dchild=1&keywords=Masks&qid=1594605017&sr=8-162
50 Pcs Disposable Face Masks 3 Ply Safety Mask Protective Mouth Cover with Elastic Earloop for Dust Air Pollution Personal Protection Use Indoor Outdoor Home Office Travel,19.99,115,($4.00/10 Items),https://amazon.com//Disposable-Protective-Pollution-Personal-Protection/dp/B086HN11NV/ref=sr_1_163?dchild=1&keywords=Masks&qid=1594605017&sr=8-163
"Comfort Lab 50Piece 3-Ply Adjustable Protective Face Mask With Earloops & Metallic Nose Strip, 8 Oz",19.99,5,($2.50/Ounce),https://amazon.com//Comfort-Lab-Adjustable-Protective-Earloops/dp/B087VTN53K/ref=sr_1_164?dchild=1&keywords=Masks&qid=1594605017&sr=8-164
