name,price,num_reviews,per_cnt_price,url
FREEFA Face Bandanas Rreuseable and Washable Cotton made with Breathing valve Five-layer Activated Carbon Filters Replaceable Haze Dust Face Health for Adults.Ship from USA! (4ColofullⅠ+12Filter),22.00,42,-,https://amazon.com//FREEFA-Rreuseable-Five-layer-Replaceable-Adults-Ship/dp/B089RH4PGJ/ref=sr_1_253?dchild=1&keywords=Masks&qid=1594605021&sr=8-253
"Dekugaa Full Face Snorkel Mask, Snorkeling Mask with Detachable Camera Mount, 180 Degree Panoramic Viewing Upgraded Dive Mask with Safety Breathing System Dry Top Set Anti-Fog Anti-Leak",22.99,246,-,https://amazon.com//Dekugaa-Snorkeling-Detachable-Panoramic-Breathing/dp/B086GX5B8M/ref=sr_1_254?dchild=1&keywords=Masks&qid=1594605021&sr=8-254
"2 Pack Reusable Cotton Cover with Breathing Valve, Feeke Washable Cotton Cloth Adjustable Ear Loops with 4 Pcs Filters for Men and Women - Black",19.99,8,($10.00/Item),https://amazon.com//Reusable-Breathing-Feeke-Washable-Adjustable/dp/B08BF8XLJK/ref=sr_1_255?dchild=1&keywords=Masks&qid=1594605021&sr=8-255
"50 PCS Disposable Face Masks, Daily Protective Mask for Face with Knitted Earloops (Blue)",28.99,69,More Buying Choices,https://amazon.com//Disposable-Masks-Protective-Knitted-Earloops/dp/B08716L7MH/ref=sr_1_256?dchild=1&keywords=Masks&qid=1594605021&sr=8-256
X-CHENG Scarf Bandanas Mask - Multi-Purpose Bandana Mask Neck Gaiter with Safety Carbon Filters for Men Women Sports&Outdoors,23.99,423,-,https://amazon.com//X-CHENG-Scarf-Bandanas-Mask-Multi-Purpose/dp/B088K5YGTG/ref=sr_1_257?dchild=1&keywords=Masks&qid=1594605021&sr=8-257
"Home Zone Living 50pc Disposable Face Mask, USA-Based Shipping & Support, 3-Ply, Latex Free, FDA-Registered Manufacturer, Elastic Ear Loops, Comfortable, Breathable, Medical, Surgical Style",29.99,26,($0.60/Count),https://amazon.com//Home-Zone-Living-FDA-Registered-Manufacturer/dp/B088M5VHS3/ref=sr_1_258?dchild=1&keywords=Masks&qid=1594605021&sr=8-258
"Disposable Face Mask, Breathable Masks (Pack of 50)",27.99,43,More Buying Choices,https://amazon.com//Disposable-Face-Mask-Breathable-Masks/dp/B088QBYTTD/ref=sr_1_259?dchild=1&keywords=Masks&qid=1594605021&sr=8-259
"3pcs X 1 Pack Water Repellent Face Masks 3D Design Professional Quality, Clean-Finished Fashion Fabric Face Covering Adjustable Nose Bridge, Washable, size (10"" x 5.5"") (Khaki-White-Brown)",20.00,35,($6.67/Count),https://amazon.com//Repellent-Professional-Clean-Finished-Covering-Adjustable/dp/B088XD975B/ref=sr_1_260?dchild=1&keywords=Masks&qid=1594605021&sr=8-260
"1 PCS Washable Reusable 2 Layers Breathable Face Madks Facial M_ask C-over, BE",12.99,7,-,https://amazon.com//gp/slredirect/picassoRedirect.html/ref=pa_sp_mtf_aps_sr_pg6_1?ie=UTF8&adId=A02670651JF23UN73BRPT&url=%2FWashable-Reusable-Layers-Breathable-Facial%2Fdp%2FB089GR7J5M%2Fref%3Dsr_1_261_sspa%3Fdchild%3D1%26keywords%3DMasks%26qid%3D1594605021%26sr%3D8-261-spons%26psc%3D1&qualifier=1594605023&id=3877147551538419&widgetName=sp_mtf
"3 PCS Women Men 2 Layer Breathable Reusable Cloth Face Madks, Multi7",24.99,3,-,https://amazon.com//gp/slredirect/picassoRedirect.html/ref=pa_sp_mtf_aps_sr_pg6_1?ie=UTF8&adId=A040201811BHHS5KCIGZD&url=%2FWomen-Layer-Breathable-Reusable-Multi7%2Fdp%2FB08BR4JPQV%2Fref%3Dsr_1_262_sspa%3Fdchild%3D1%26keywords%3DMasks%26qid%3D1594605021%26sr%3D8-262-spons%26psc%3D1&qualifier=1594605023&id=3877147551538419&widgetName=sp_mtf
"LRKC Cycling Face Cover, Activated Carbon Windproof Madks with F-ilter for Outdoor Sportswear",47.99,8,-,https://amazon.com//gp/slredirect/picassoRedirect.html/ref=pa_sp_mtf_aps_sr_pg6_1?ie=UTF8&adId=A006309530S4E2Y8EIGWI&url=%2FLRKC-Reusable-Washable-Breathable-Breathing%2Fdp%2FB08CKBH3D9%2Fref%3Dsr_1_263_sspa%3Fdchild%3D1%26keywords%3DMasks%26qid%3D1594605021%26sr%3D8-263-spons%26psc%3D1&qualifier=1594605023&id=3877147551538419&widgetName=sp_mtf
"I DEW CARE Space Kitten | Charcoal Face Mask Exfoliating Galactic Black Peel-off Face Mask (T-Zone Only) | Korean Skincare, Facial Treatment, Cruelty-free, Gluten-free, Paraben-free",23.00,666,($8.01/Fl Oz),https://amazon.com//gp/slredirect/picassoRedirect.html/ref=pa_sp_mtf_aps_sr_pg6_1?ie=UTF8&adId=A03805803B1CNMFP4KPQY&url=%2FDEW-CARE-Exfoliating-Cruelty-free-Paraben-free%2Fdp%2FB07XLNTPJZ%2Fref%3Dsr_1_264_sspa%3Fdchild%3D1%26keywords%3DMasks%26qid%3D1594605021%26sr%3D8-264-spons%26psc%3D1&qualifier=1594605023&id=3877147551538419&widgetName=sp_mtf
"Dre Health 3 Ply Disposable Face Masks, 20 Count - Made in The USA - Ear Loop Face Shields - Helps Filter Dust, Pollen - Latex Free, Glass Free Filter, Non Woven",22.98,52,($1.15/Count),https://amazon.com//Dre-Health-Disposable-Masks-Count/dp/B088KTHFC1/ref=sr_1_265?dchild=1&keywords=Masks&qid=1594605021&sr=8-265
"Yoodelife Anti-dust Black Mouth Mask, Unisex Cotton Face Mask Muffle Mask Anime Mask for Cycling Travel Outdoors for Adult Men Women,Style 2, Pack of 3",19.99,"1,070",($6.66/Item),https://amazon.com//Yoodelife-Anti-dust-Unisex-Cycling-Outdoors/dp/B085BNTQYS/ref=sr_1_266?dchild=1&keywords=Masks&qid=1594605021&sr=8-266
Skechers Sport Men's Equalizer Coast to Coast Mule,56.92,"2,143",-,https://amazon.com//Skechers-Sport-Equalizer-Coast-Black/dp/B01APLBZNY/ref=sr_1_267?dchild=1&keywords=Masks&qid=1594605021&sr=8-267
"3 Pack Unisex Washable Reusable Cotton Face Madks W/Valve-Filter C_over, BG",32.99,36,-,https://amazon.com//Unisex-Washable-Reusable-Cotton-Valve-Filter/dp/B089SFNNGN/ref=sr_1_268?dchild=1&keywords=Masks&qid=1594605021&sr=8-268
"ABG Accessories Girls' 3-Pack Kid Fashionable Germ Protection, Reusable Fabric Face Mask Age 4-14",12.99,43,-,https://amazon.com//ABG-Accessories-Fashionable-Protection-Reusable/dp/B088FZTBDL/ref=sr_1_269?dchild=1&keywords=Masks&qid=1594605021&sr=8-269
3 Pack Cotton Black Face Cover Unisex Adjustable Washable and Reusable Mouth Cover,15.69,28,-,https://amazon.com//Cotton-Unisex-Adjustable-Washable-Reusable/dp/B08771X8P3/ref=sr_1_270?dchild=1&keywords=Masks&qid=1594605021&sr=8-270
"Oxgord Face Mask - 100 Disposable Ear-loop Masks (50ctper Box, Pack Of 2) Protection From Dust, Pollen, More - Mouth Cover Ideal for Everyday Use, Blue, 1count",16.00,89,More Buying Choices,https://amazon.com//Oxgord-Face-Mask-Disposable-Protection/dp/B0887T7VTZ/ref=sr_1_271?dchild=1&keywords=Masks&qid=1594605021&sr=8-271
"Face Mask Disposable, 50 PCS AXHKIO 3 Layers Safety Masks Comfortable for Blocking Dust Air Pollution Protection",23.99,28,($23.99/Count),https://amazon.com//Disposable-AXHKIO-Comfortable-Pollution-Protection/dp/B0897PJT5M/ref=sr_1_272?dchild=1&keywords=Masks&qid=1594605021&sr=8-272
"The Mumbling Monkey Single Use Blue Face Mask, 3-ply, Non-medical, 100 Pack, 100count",30.99,2,($0.31/Count),https://amazon.com//Mumbling-Monkey-Single-Non-medical-100count/dp/B08BJB29JM/ref=sr_1_273?dchild=1&keywords=Masks&qid=1594605021&sr=8-273
"No Nonsense Kids' Face Mask, Black/Black/Navy/Navy/Grey, Youth",15.41,1,-,https://amazon.com//No-Nonsense-Kids-Black-Youth/dp/B088MLWWFP/ref=sr_1_274?dchild=1&keywords=Masks&qid=1594605021&sr=8-274
M Plus Cover [2nd Generation] With Extra Active Carbon Filters (2+8 Filters),36.99,97,-,https://amazon.com//Cover-Generation-Active-Carbon-Filters/dp/B087PGTZZG/ref=sr_1_275?dchild=1&keywords=Masks&qid=1594605021&sr=8-275
"Facial Protection Filtration 95%, Anti-Fog, Dust-Proof Adjustable Nose wire Headgear Full Face Protection Masks(Activated carbon filter can be inserted）",16.99,83,More Buying Choices,https://amazon.com//Protection-Filtration-Dust-Proof-Adjustable-Activated/dp/B089DPHX8K/ref=sr_1_276?dchild=1&keywords=Masks&qid=1594605021&sr=8-276
"Bandana for Rave Face Mask Dust Wind UV Sun, Neck Gaiter Tube Mask Headwear, Motorcycle Face Mask for Women Men Face Scarf",15.99,103,-,https://amazon.com//Washable-Reusable-Bandana-Protection-Balaclava/dp/B089LRNZY4/ref=sr_1_277?dchild=1&keywords=Masks&qid=1594605021&sr=8-277
Reusable Fabric Face Mask Unisex - Outdoor Print Cloth Comfy Breathable Mouth Shield Washable Covering Protection Men Women (Pleated/Ear Loop - Floral Romance Navy Fuchsia),9.99,3,-,https://amazon.com//Reusable-Fabric-Face-Mask-Unisex/dp/B089DW6W3C/ref=sr_1_278?dchild=1&keywords=Masks&qid=1594605021&sr=8-278
Fashionable & Washable Face Mask - Anti Dust Face Mask Child and Women Design,15.95,6,-,https://amazon.com//TURAAG-Solid-Fashion-Child-Women/dp/B088M7B4SL/ref=sr_1_279?dchild=1&keywords=Masks&qid=1594605021&sr=8-279
"American US Flag Face Bandana Neck Gaiter, Sun UV Dust Protection Reusable Half Mask Scarf Motorcycle Balaclava for Men Women",23.99,389,-,https://amazon.com//American-Protection-Reusable-Motorcycle-Balaclava/dp/B089GXPYJD/ref=sr_1_280?dchild=1&keywords=Masks&qid=1594605021&sr=8-280
Grey Mask (Miss Silver #1),19.99,by ,Other format: ,https://amazon.com//Grey-Mask-Miss-Silver-1/dp/1709211997/ref=sr_1_281?dchild=1&keywords=Masks&qid=1594605021&sr=8-281
5 Pack Unisex Fashion Stretch Lightweight Cotton Covering Face and Mouth Reusable Washable Adjustable,26.97,70,-,https://amazon.com//Lightweight-Covering-Reusable-Washable-Adjustable/dp/B0888916VR/ref=sr_1_282?dchild=1&keywords=Masks&qid=1594605021&sr=8-282
Hanes Men’s Ultimate Cotton Heavyweight Pullover Hoodie Sweatshirt,12.00,"3,861",-,https://amazon.com//Hanes-Pullover-Ultimate-Heavyweight-Fleece/dp/B00JUMDZNI/ref=sr_1_283?dchild=1&keywords=Masks&qid=1594605021&sr=8-283
Studio 21 Graphix Cotton Outdoor Haze Dust Face Health Protection Face Macks with Eyes Bandana + 2 Filters (3pcs+6Filter),,6,-,https://amazon.com//Graphix-Outdoor-Protection-Bandana-Filters/dp/B0895TKMMR/ref=sr_1_284?dchild=1&keywords=Masks&qid=1594605021&sr=8-284
"StringKing Reusable Cloth Face Mask - Protection for Kids and Adults - USA-Made, Washable Face Masks (4 Pack - Adult - Black)",29.99,603,($7.50/Count),https://amazon.com//StringKing-Reusable-Cloth-Face-Mask/dp/B087WKJX6Z/ref=sr_1_285?dchild=1&keywords=Masks&qid=1594605021&sr=8-285
Beyond The Mask,3.99,685,-,https://amazon.com//Beyond-Mask-Andrew-Cheney/dp/B083FL7W1J/ref=sr_1_286?dchild=1&keywords=Masks&qid=1594605021&sr=8-286
"Lanier Wellness Adult Reusable Face Covers (Pack of 2), Blue/White",13.97,108,-,https://amazon.com//Lanier-Wellness-Adult-3-Layer-Reusable/dp/B087ZK8H56/ref=sr_1_287?dchild=1&keywords=Masks&qid=1594605021&sr=8-287
Elastic Band String 125 Yards (114 Meters) 1/4 Inch White and Nose Wire Strip(100pcs) Bundle,18.99,382,-,https://amazon.com//Elastic-String-Meters-100pcs-Bundle/dp/B086V23BMJ/ref=sr_1_288?dchild=1&keywords=Masks&qid=1594605021&sr=8-288
20PCS Adult PM2.5 Activated Carbon Filter Insert 5 Layers Replaceable Anti Haze Masks Filter Paper,15.99,43,-,https://amazon.com//Activated-Carbon-Filter-Insert-Replaceable/dp/B088NHVLC2/ref=sr_1_289?dchild=1&keywords=Masks&qid=1594605021&sr=8-289
EnCaier 50 Pack Disposable Face Masks - For Home & Office - 3-Ply Breathable & Comfortable Filter Safety Mask,17.99,39,($0.36/Count),https://amazon.com//EnCaier-Pack-Disposable-Face-Masks/dp/B08883KP7X/ref=sr_1_290?dchild=1&keywords=Masks&qid=1594605021&sr=8-290
PAMASE 3 Pcs American Flag Outdoor Face Mask- Multifunctional Seamless Microfiber American Flag UV Protection Face Neck Shields Headwear for Men&Women Motorcycle Hiking Cycling Ski Snowboard(Grey),16.99,"1,759",-,https://amazon.com//PAMASE-Multifunctional-Microfiber-Protection-Motorcycle/dp/B07PVF4W9H/ref=sr_1_291?dchild=1&keywords=Masks&qid=1594605021&sr=8-291
Brixton Reversible Face Mask Blue Engineer Stripe One Size,12.99,0,-,https://amazon.com//Brixton-Reversible-Face-Engineer-Stripe/dp/B089FB1TCT/ref=sr_1_292?dchild=1&keywords=Masks&qid=1594605021&sr=8-292
Buttonsmith Black Adult Cotton Adjustable Face Mask with Filter Pocket - Quantity 1 - Two Layer Soft T-Shirt Material - Washable - Made in The USA,14.99,17,($14.99/Count),https://amazon.com//Buttonsmith-Cotton-Adjustable-Filter-Pocket/dp/B08B7RRTF4/ref=sr_1_293?dchild=1&keywords=Masks&qid=1594605021&sr=8-293
"Pack of 500 Single Use Disposable Face Mask, 2 FREE Hand Sanitizer 8 Oz. Bottles included, Sanitizer Made in USA, 3-Ply Facial Cover Masks with Ear Loop",109.99,15,-,https://amazon.com//500-Single-Disposable-Sanitizer-Bottles-included/dp/B08BFHSL85/ref=sr_1_294?dchild=1&keywords=Masks&qid=1594605021&sr=8-294
Israeli NBC Gas Mask Filter Nato Specifications for 40mm Gas Masks,39.99,1,-,https://amazon.com//Israeli-Mask-Filter-Specifications-Masks/dp/B08C5MYPYH/ref=sr_1_295?dchild=1&keywords=Masks&qid=1594605021&sr=8-295
"Galloping Horse 3-ply Disposable Face Mask Pack Of 50 - Fast Ship From Usa - Dust & Droplet Protection, Home Office & Outdoor Use, 1count",29.95,0,-,https://amazon.com//Galloping-Horse-3-ply-Disposable-Face/dp/B088M9T928/ref=sr_1_296?dchild=1&keywords=Masks&qid=1594605021&sr=8-296
"3 Pcs Unisex Covering, 2 ply Breathable Face C-over, Adjustable Rave Face Madks for UV Sun,Blue",22.99,5,($22.99/Count),https://amazon.com//gp/slredirect/picassoRedirect.html/ref=pa_sp_btf_aps_sr_pg6_1?ie=UTF8&adId=A10126031QWP2JAQLK60U&url=%2FUnisex-Covering-Breathable-C-over-Adjustable%2Fdp%2FB089F7P9L9%2Fref%3Dsr_1_297_sspa%3Fdchild%3D1%26keywords%3DMasks%26qid%3D1594605021%26sr%3D8-297-spons%26psc%3D1&qualifier=1594605023&id=3877147551538419&widgetName=sp_btf
"Facial Protection Filtration 95%, Anti-Fog, Dust-Proof With activated carbon filter Adjustable Headgear Nose wire Full Face Protection Masks 1pcs（One mask plus two filters）",19.98,45,-,https://amazon.com//gp/slredirect/picassoRedirect.html/ref=pa_sp_btf_aps_sr_pg6_1?ie=UTF8&adId=A1024944112B9XWJSOUZL&url=%2FProtection-Filtration-Dust-Proof-activated-Adjustable%2Fdp%2FB08CD8C4J1%2Fref%3Dsr_1_298_sspa%3Fdchild%3D1%26keywords%3DMasks%26qid%3D1594605021%26sr%3D8-298-spons%26psc%3D1&qualifier=1594605023&id=3877147551538419&widgetName=sp_btf
"2 Pcs Washable Cotton Face Masc with Filter Pocket, Reusable Mouth Madks, Cloth Fabric Adjustable,Grey",24.99,0,-,https://amazon.com//gp/slredirect/picassoRedirect.html/ref=pa_sp_btf_aps_sr_pg6_1?ie=UTF8&adId=A002434539KHN0ODUVQAI&url=%2FWashable-Cotton-Filter-Reusable-Adjustable%2Fdp%2FB08CMW7PLV%2Fref%3Dsr_1_299_sspa%3Fdchild%3D1%26keywords%3DMasks%26qid%3D1594605021%26sr%3D8-299-spons%26psc%3D1&qualifier=1594605023&id=3877147551538419&widgetName=sp_btf
"2 PCS Washable Reusable Adjustable Cotton Face Madks, B2G",24.99,79,-,https://amazon.com//gp/slredirect/picassoRedirect.html/ref=pa_sp_btf_aps_sr_pg6_1?ie=UTF8&adId=A02827933GYP2YZYKKC8O&url=%2FWashable-Reusable-Adjustable-Cotton-Madks%2Fdp%2FB089SRNLFF%2Fref%3Dsr_1_300_sspa%3Fdchild%3D1%26keywords%3DMasks%26qid%3D1594605021%26sr%3D8-300-spons%26psc%3D1&qualifier=1594605023&id=3877147551538419&widgetName=sp_btf
Solid Color 3D Face Madks Reusable Washable with Adjustable Ear Loops Nose Wire,18.99,0,-,https://amazon.com//gp/slredirect/picassoRedirect.html/ref=pa_sp_atf_next_aps_sr_pg7_1?ie=UTF8&adId=A0695841WYTGHAG0QI94&url=%2FReusable-Washable-Adjustable-Breathable-Protective%2Fdp%2FB08BKZKWBD%2Fref%3Dsr_1_289_sspa%3Fdchild%3D1%26keywords%3DMasks%26qid%3D1594605023%26sr%3D8-289-spons%26psc%3D1&qualifier=1594605025&id=8287349834985460&widgetName=sp_atf_next
"Five-layer filter, dust-proof, anti-pollen, anti-fog, US warehouse delivery, fast delivery, 7 days delivery (10)",28.88,0,-,https://amazon.com//gp/slredirect/picassoRedirect.html/ref=pa_sp_atf_next_aps_sr_pg7_1?ie=UTF8&adId=A060108934UR4AFGC2606&url=%2FFive-layer-dust-proof-anti-pollen-anti-fog-warehouse%2Fdp%2FB08CCFWGZL%2Fref%3Dsr_1_290_sspa%3Fdchild%3D1%26keywords%3DMasks%26qid%3D1594605023%26sr%3D8-290-spons%26psc%3D1&qualifier=1594605025&id=8287349834985460&widgetName=sp_atf_next
"5-Layer Filter, dustproof, Anti-Pollen, Anti-Fog, Fast delivery,20PCS,",47.77,0,-,https://amazon.com//gp/slredirect/picassoRedirect.html/ref=pa_sp_atf_next_aps_sr_pg7_1?ie=UTF8&adId=A0601033U330BA700MUZ&url=%2F5-Layer-dustproof-Anti-Pollen-Anti-Fog-delivery%2Fdp%2FB08CCH599L%2Fref%3Dsr_1_291_sspa%3Fdchild%3D1%26keywords%3DMasks%26qid%3D1594605023%26sr%3D8-291-spons%26psc%3D1&qualifier=1594605025&id=8287349834985460&widgetName=sp_atf_next
"face and Neck Protectors for Men and Women Motorcycle Riding mask Turban， Multi-Functional Seamless Ultra-fine ice Silk UV Protection, dustproof（1 Pcs）",12.99,4,-,https://amazon.com//gp/slredirect/picassoRedirect.html/ref=pa_sp_atf_next_aps_sr_pg7_1?ie=UTF8&adId=A06183562C2YV37OKPRG5&url=%2FProtectors-Motorcycle-Multi-Functional-Ultra-fine-dustproof%25EF%25BC%25881%2Fdp%2FB08CNDQPBG%2Fref%3Dsr_1_292_sspa%3Fdchild%3D1%26keywords%3DMasks%26qid%3D1594605023%26sr%3D8-292-spons%26psc%3D1&qualifier=1594605025&id=8287349834985460&widgetName=sp_atf_next
"Foot Peel Mask - 2 Pack - For Cracked Heels, Dead Skin & Calluses - Make Your Feet Baby Soft & Get a Smooth Skin, Removes & Repairs Rough Heels, Dry Toe Skin - Exfoliating Peeling Natural Treatment",29.99,"5,108",($15.00/Count),https://amazon.com//Pairs-Exfoliating-Foot-Peel-Mask/dp/B078WCTVV9/ref=sr_1_293?dchild=1&keywords=Masks&qid=1594605023&sr=8-293
"100-Pack 3-PLY Disposable Face Mask, Perfect Fit, (Two-50 Packs)",20.99,0,More Buying Choices,https://amazon.com//100-Pack-3-PLY-Disposable-Perfect-Two-50/dp/B08C9CL8GD/ref=sr_1_294?dchild=1&keywords=Masks&qid=1594605023&sr=8-294
Triple Layer Layer Reusable Black Covers by Pegasus is made from Cotton double Muslin Combo with Filter Slots for Protection (B),22.99,10,($3.83/Count),https://amazon.com//Triple-Reusable-Covers-Pegasus-Protection/dp/B0881XC515/ref=sr_1_295?dchild=1&keywords=Masks&qid=1594605023&sr=8-295
Amazon Essentials Men's Regular-Fit Long-Sleeve Plaid Flannel Shirt,18.00,"5,731",-,https://amazon.com//Amazon-Essentials-Regular-Fit-Long-Sleeve-XX-Large/dp/B073XP65KN/ref=sr_1_296?dchild=1&keywords=Masks&qid=1594605023&sr=8-296
20PCS PM2.5 Activated Carbon Filter Replaceable Anti Haze Filter Paper Pad for Mouth Cover,12.21,67,-,https://amazon.com//20PCS-Activated-Carbon-Filter-Replaceable/dp/B087JXTG3G/ref=sr_1_297?dchild=1&keywords=Masks&qid=1594605023&sr=8-297
50PCS Disposable Face Mask Mouth Face Cover Dust-Proof Personal Protection,27.99,25,($0.56/Count),https://amazon.com//50PCS-Disposable-Dust-Proof-Personal-Protection/dp/B08974MS9J/ref=sr_1_298?dchild=1&keywords=Masks&qid=1594605023&sr=8-298
20PCS PCS Adult PM2.5 Activated Carbon Filter 5 Layers Replaceable Anti Haze Filter Paper (20PCS),15.95,118,More Buying Choices,https://amazon.com//Activated-Carbon-Filter-Layers-Replaceable/dp/B087N8BXVX/ref=sr_1_299?dchild=1&keywords=Masks&qid=1594605023&sr=8-299
"3-PLY Disposable Face Mask, Perfect Fit, 10 Packages of 10 Mask - 100 PACK",19.00,10,More Buying Choices,https://amazon.com//3-PLY-Disposable-Face-Perfect-Packages/dp/B0879JTRWZ/ref=sr_1_300?dchild=1&keywords=Masks&qid=1594605023&sr=8-300
"Disposable Face Mask (White), Pack of 50, with 3 Ply Breathable Filter Layer for Men, Women and Kids, 2x Adjustable Face Mask Extender Strap Included",29.99,59,More Buying Choices,https://amazon.com//Disposable-Breathable-Adjustable-Extender-Included/dp/B0888TP7KX/ref=sr_1_301?dchild=1&keywords=Masks&qid=1594605023&sr=8-301
O'Neill Fashion Mask Camo One Size,11.00,0,-,https://amazon.com//ONeill-Fashion-Mask-Camo-Size/dp/B08BLWT8TT/ref=sr_1_302?dchild=1&keywords=Masks&qid=1594605023&sr=8-302
"3 Pack Unisex Face Covering, Facial Covering with Adjustable Nose Clip,Black Dust Cotton, Washable, Reusable Cotton Fabric for Men and Women【US in Stock】",14.98,21,($4.99/Count),https://amazon.com//Covering-Adjustable-Washable-Reusable-Women%E3%80%90US/dp/B089WGY5SZ/ref=sr_1_303?dchild=1&keywords=Masks&qid=1594605023&sr=8-303
"5PCS Fashion Protective, Unisex Black Dust Cotton, Washable, Reusable Cotton Fabric",18.99,69,($18.99/Count),https://amazon.com//Fashion-Protective-Unisex-Washable-Reusable/dp/B088QCS3MB/ref=sr_1_304?dchild=1&keywords=Masks&qid=1594605023&sr=8-304
"2 Pack Face mask Cover with 2 PM 2.5 filter, Washable mask, Reusable. Anti dust, Cloth face mask with filter… (Blue/Gray)",19.75,0,-,https://amazon.com//Cover-filter-Washable-Reusable-Cloth/dp/B08BJS566C/ref=sr_1_305?dchild=1&keywords=Masks&qid=1594605023&sr=8-305
"Fashion Protective Face Mask Dust Cotton Mouth Washable Reusable Mask with Replacement Filter Slot, Made in Korea (4 Packs) (black)",31.99,537,($8.00/Count),https://amazon.com//Fashion-Protective-Washable-Reusable-Replacement/dp/B086HL96V6/ref=sr_1_306?dchild=1&keywords=Masks&qid=1594605023&sr=8-306
"Daily Face Cover, 3 Pcs Anti Particle Dust Washable Reusable Skin Friendly Face Cover For Outdoor Windproof",15.99,13,($6.48/Ounce),https://amazon.com//Particle-Washable-Reusable-Friendly-Windproof/dp/B0875NSZ7K/ref=sr_1_307?dchild=1&keywords=Masks&qid=1594605023&sr=8-307
"Sleep Mask 3 Pack, Upgraded 3D Contoured 100% Blackout Eye Mask for Sleeping with Adjustable Strap, Comfortable & Soft Night Blindfold for Women Men, Eye Shades for Travel/Naps, Purple/Gray/Blue",11.99,"4,382",($11.99/Count),https://amazon.com//Upgraded-Contoured-Adjustable-Comfortable-Blindfold/dp/B087M734RM/ref=sr_1_308?dchild=1&keywords=Masks&qid=1594605023&sr=8-308
"5 PCS Washable Reusable 2 Layers Breathable Face Madks Facial M_ask C-over, B",28.99,7,-,https://amazon.com//gp/slredirect/picassoRedirect.html/ref=pa_sp_mtf_aps_sr_pg7_1?ie=UTF8&adId=A02901693BUZHQDRWUQG3&url=%2FLavable-reutilizable-transpirable-rostro-C-over%2Fdp%2FB089GQWMMR%2Fref%3Dsr_1_309_sspa%3Fdchild%3D1%26keywords%3DMasks%26qid%3D1594605023%26sr%3D8-309-spons%26psc%3D1&qualifier=1594605025&id=8287349834985460&widgetName=sp_mtf
"YOUNG LOVE Men Women Washable Face C-Over Face_M-Asks, Light Blue,3 Pack",16.99,1,-,https://amazon.com//gp/slredirect/picassoRedirect.html/ref=pa_sp_mtf_aps_sr_pg7_1?ie=UTF8&adId=A04742021D1S1PDWCDDB8&url=%2FPara-hombre-mujer-talla-%25C3%25BAnica%2Fdp%2FB0887YBW18%2Fref%3Dsr_1_310_sspa%3Fdchild%3D1%26keywords%3DMasks%26qid%3D1594605023%26sr%3D8-310-spons%26psc%3D1&qualifier=1594605025&id=8287349834985460&widgetName=sp_mtf
"Facial Protection Filtration, Anti-Fog, Dust-Proof With activated carbon filter Adjustable Nose wire Headgear Full Face Protection Reusable Face Health Masks",19.99,16,-,https://amazon.com//gp/slredirect/picassoRedirect.html/ref=pa_sp_mtf_aps_sr_pg7_1?ie=UTF8&adId=A0985928R3JX5LYP8UYD&url=%2FProtection-Filtration-Dust-Proof-activated-Adjustable%2Fdp%2FB08CRYNB57%2Fref%3Dsr_1_311_sspa%3Fdchild%3D1%26keywords%3DMasks%26qid%3D1594605023%26sr%3D8-311-spons%26psc%3D1&qualifier=1594605025&id=8287349834985460&widgetName=sp_mtf
"3 PCS Women Men 2 Layer Breathable Reusable Cloth Face Madks, Multi8",24.99,3,-,https://amazon.com//gp/slredirect/picassoRedirect.html/ref=pa_sp_mtf_aps_sr_pg7_1?ie=UTF8&adId=A060615515JHU2S4TQ5VH&url=%2FWomen-Layer-Breathable-Reusable-Multi8%2Fdp%2FB08BRHQ11X%2Fref%3Dsr_1_312_sspa%3Fdchild%3D1%26keywords%3DMasks%26qid%3D1594605023%26sr%3D8-312-spons%26psc%3D1&qualifier=1594605025&id=8287349834985460&widgetName=sp_mtf
"EVGLOW Mask Strap Extender,Anti-Tightening Mask Holder Hook Ear Strap 2020 Update",9.99,141,-,https://amazon.com//Extender-Anti-Tightening-Accessories-Extension-Relieved/dp/B087LX7TJN/ref=sr_1_313?dchild=1&keywords=Masks&qid=1594605023&sr=8-313
Dickies Men's Short-Sleeve Coverall,34.32,"3,343",-,https://amazon.com//Dickies-camisa-overol-mangas-cortas/dp/B005FXH41A/ref=sr_1_314?dchild=1&keywords=Masks&qid=1594605023&sr=8-314
"2 Pcs Washable Cotton Face Masc with Filter Pocket, Reusable Mouth Madks, Cloth Fabric Adjustable,Black-A",24.99,0,-,https://amazon.com//gp/slredirect/picassoRedirect.html/ref=pa_sp_btf_aps_sr_pg7_1?ie=UTF8&adId=A0016589GMB9QM7I6WKC&url=%2FWashable-Cotton-Filter-Reusable-Adjustable%2Fdp%2FB08CN2R9KY%2Fref%3Dsr_1_315_sspa%3Fdchild%3D1%26keywords%3DMasks%26qid%3D1594605023%26sr%3D8-315-spons%26psc%3D1&qualifier=1594605025&id=8287349834985460&widgetName=sp_btf
"Facial Protection Filtration 95%, Anti-Fog, Dust-Proof With activated Headgear Nose wire Full Face Protection Masks",16.99,38,-,https://amazon.com//gp/slredirect/picassoRedirect.html/ref=pa_sp_btf_aps_sr_pg7_1?ie=UTF8&adId=A08610392HFIJ22RZT103&url=%2FProtection-Filtration-Anti-Fog-Dust-Proof-activated%2Fdp%2FB08CDDL9LQ%2Fref%3Dsr_1_316_sspa%3Fdchild%3D1%26keywords%3DMasks%26qid%3D1594605023%26sr%3D8-316-spons%26psc%3D1&qualifier=1594605025&id=8287349834985460&widgetName=sp_btf
"LRKC Cycling Face Cover, Activated Carbon Windproof Madks with F-ilter for Outdoor Sportswear",39.99,8,-,https://amazon.com//gp/slredirect/picassoRedirect.html/ref=pa_sp_btf_aps_sr_pg7_1?ie=UTF8&adId=A00621032676FQ35S3FHD&url=%2FLRKC-Included-Replaceable-Washable-Additional%2Fdp%2FB08CKBWQJM%2Fref%3Dsr_1_317_sspa%3Fdchild%3D1%26keywords%3DMasks%26qid%3D1594605023%26sr%3D8-317-spons%26psc%3D1&qualifier=1594605025&id=8287349834985460&widgetName=sp_btf
"Facial Protection Filtration 95%, Anti-Fog, Dust-Proof Adjustable reusable and washable Headgear Full Face Protection Masks",17.99,40,-,https://amazon.com//gp/slredirect/picassoRedirect.html/ref=pa_sp_btf_aps_sr_pg7_1?ie=UTF8&adId=A08905922YMOC2GKP3UBT&url=%2FProtecci%25C3%25B3n-filtraci%25C3%25B3n-antiniebla-reutilizable-protecci%25C3%25B3n%2Fdp%2FB089CQ5JXJ%2Fref%3Dsr_1_318_sspa%3Fdchild%3D1%26keywords%3DMasks%26qid%3D1594605023%26sr%3D8-318-spons%26psc%3D1&qualifier=1594605025&id=8287349834985460&widgetName=sp_btf
