name,price,num_reviews,per_cnt_price,url
"YOUNG LOVE Summer Reusable Face Madks, Adjustable Ear Loop Face Face s-hilled, 2 ply Breathable Mouth C-Over,1 pc Marble Black",12.99,21,-,https://amazon.com//gp/slredirect/picassoRedirect.html/ref=pa_sp_mtf_aps_sr_pg4_1?ie=UTF8&adId=A00287372KA2SVX9N8ABI&url=%2FYOUNG-LOVE-Reusable-Adjustable-Breathable%2Fdp%2FB089FCXQR9%2Fref%3Dsr_1_165_sspa%3Fdchild%3D1%26keywords%3DMasks%26qid%3D1594605017%26sr%3D8-165-spons%26psc%3D1&qualifier=1594605018&id=1319490864530914&widgetName=sp_mtf
"1 PCS Washable Reusable 2 Layers Breathable Face Madks Facial M_ask C-over, B",13.99,7,-,https://amazon.com//gp/slredirect/picassoRedirect.html/ref=pa_sp_mtf_aps_sr_pg4_1?ie=UTF8&adId=A10195542JPOE7ZU7SH0W&url=%2FWashable-Reusable-Layers-Breathable-Facial%2Fdp%2FB089GRFKXN%2Fref%3Dsr_1_166_sspa%3Fdchild%3D1%26keywords%3DMasks%26qid%3D1594605017%26sr%3D8-166-spons%26psc%3D1&qualifier=1594605018&id=1319490864530914&widgetName=sp_mtf
"3 PCS Women Men 2 Layer Breathable Reusable Cloth Face Madks, Camo Grey",22.99,3,-,https://amazon.com//gp/slredirect/picassoRedirect.html/ref=pa_sp_mtf_aps_sr_pg4_1?ie=UTF8&adId=A06902612G5DJ9QQL5T2W&url=%2FWomen-Layer-Breathable-Reusable-Cloth%2Fdp%2FB08BR4TFDK%2Fref%3Dsr_1_167_sspa%3Fdchild%3D1%26keywords%3DMasks%26qid%3D1594605017%26sr%3D8-167-spons%26psc%3D1&qualifier=1594605018&id=1319490864530914&widgetName=sp_mtf
"5-Layer Filter, dustproof, Anti-Pollen, Anti-Fog, Fast delivery,10PCS,",27.77,0,-,https://amazon.com//gp/slredirect/picassoRedirect.html/ref=pa_sp_mtf_aps_sr_pg4_1?ie=UTF8&adId=A06008772YISI1A6MYRU5&url=%2F5-Layer-dustproof-Anti-Pollen-Anti-Fog-delivery%2Fdp%2FB08CCGYK1Q%2Fref%3Dsr_1_168_sspa%3Fdchild%3D1%26keywords%3DMasks%26qid%3D1594605017%26sr%3D8-168-spons%26psc%3D1&qualifier=1594605018&id=1319490864530914&widgetName=sp_mtf
The Man in the Iron Mask (Annotated),3.99,by ,Other format: ,https://amazon.com//Man-Iron-Mask-Annotated-ebook/dp/B08CRK1SD7/ref=sr_1_169?dchild=1&keywords=Masks&qid=1594605017&sr=8-169
3PCS Washable Reusable Anti Dust Face Mouth Cotton (3PCS-MixColor),14.99,18,($2.14/fl oz),https://amazon.com//Breastmilk-Breastfeeding-Container-Pre-sterilized-Measurements/dp/B07RK6DBH8/ref=sr_1_170?dchild=1&keywords=Masks&qid=1594605017&sr=8-170
"CoolBELL Comfortable Mouth Cover (10PCS, 20PCS, 40PCS,50PCS, 60PCS, 100PCS)",17.99,434,-,https://amazon.com//CoolBELL-Comfortable-Mouth-20-PCS-3-Ply/dp/B086LDZMVS/ref=sr_1_171?dchild=1&keywords=Masks&qid=1594605017&sr=8-171
"Shashi Women's Set Of 3 Bright Days Ahead Face Coverings, Multi, One Size",24.00,0,-,https://amazon.com//Shashi-Womens-Bright-Ahead-Coverings/dp/B087Z3JV7B/ref=sr_1_172?dchild=1&keywords=Masks&qid=1594605017&sr=8-172
30pack PM 2.5 Activated Carbon Filter Insert Ship from USA,21.99,201,-,https://amazon.com//30pack-Activated-Carbon-Filter-Insert/dp/B087NDCD1P/ref=sr_1_173?dchild=1&keywords=Masks&qid=1594605017&sr=8-173
"Plexon Disposable Ear Loop 4 Ply Face Protection Mask, PM2.5, Non-woven Fabric, Purifying and Breathable, Medium Size with Nose Bridge Clip (Pack of 10)",31.89,87,($3.19/Count),https://amazon.com//Plexon-Disposable-Protection-Non-woven-Breathable/dp/B088JY5JBH/ref=sr_1_174?dchild=1&keywords=Masks&qid=1594605017&sr=8-174
YEMODO Outdoor Cycling Airsoft Wearing Cover 1 PCS with {Outer Layer (Washable) + Inner Layer (Replaceable)} + 2 Pieces of Breathing Valves + 4 Pieces of Filter Pads,27.99,7,-,https://amazon.com//YEMODO-Outdoor-Washable-Replaceable-Breathing/dp/B089SPJFFX/ref=sr_1_175?dchild=1&keywords=Masks&qid=1594605017&sr=8-175
"WeCare Individually Wrapped Disposable Face Masks - 50 Pack - Soft on Skin - 3 Ply Protectors with Elastic Earloops - Latex Free, Non Woven, Single Use - Effective Filtration - Retail Packaging",36.98,157,-,https://amazon.com//WeCare-Individually-Wrapped-Disposable-Masks/dp/B08914CRBT/ref=sr_1_176?dchild=1&keywords=Masks&qid=1594605017&sr=8-176
"Forno Nose Bridge Strips for Mask,Oceantree Double Wire Flat Plastic Strips Straps Adjustable Nose Clips Wire for DIY Face Mask Making Accessories for Sewing Crafts (100pcs)",7.99,12,-,https://amazon.com//Forno-Oceantree-Plastic-Adjustable-Accessories/dp/B088PV4988/ref=sr_1_177?dchild=1&keywords=Masks&qid=1594605017&sr=8-177
50 Pcs Disposable Face Masks 3 Ply Safety Mask Protective Mouth Cover with Elastic Earloop for Dust Air Pollution Personal Protection Use Indoor Outdoor Home Office Travel,28.99,230,($0.58/Count),https://amazon.com//Disposable-Protective-Pollution-Personal-Protection/dp/B086KKWTQ5/ref=sr_1_178?dchild=1&keywords=Masks&qid=1594605017&sr=8-178
"Medi+Sons Supply Re-usable Washable Designer Fabric Women's Face Covering Mask, Decorative Floral Patterns, 3 Pack",20.00,51,More Buying Choices,https://amazon.com//Medi-Sons-Supply-Re-usable-Decorative/dp/B088T35QQX/ref=sr_1_179?dchild=1&keywords=Masks&qid=1594605017&sr=8-179
"5pc Unisex, washable and reusable",18.99,197,($3.80/Count),https://amazon.com//5pc-Unisex-washable-and-reusable/dp/B0876PXCQ2/ref=sr_1_180?dchild=1&keywords=Masks&qid=1594605017&sr=8-180
"TICONN Neck Gaiter (2 Pack), Face Cover Scarf, Summer Cool Breathable Lightweight, Ideal for Fishing Hiking Running Cycling",13.95,203,-,https://amazon.com//TICONN-Heather-Breathable-Lightweight-Wind-proof/dp/B087PPW249/ref=sr_1_181?dchild=1&keywords=Masks&qid=1594605017&sr=8-181
1 Pack Washable Reusable Black Cotton Mouth-Cover with 1 Pc Activated Carbon Filter Unisex F-a-c-e Covers Protection from Dust Pollen Pet Dander,12.99,17,-,https://amazon.com//Washable-Reusable-Mouth-Cover-Activated-Protection/dp/B08B5C5ZX3/ref=sr_1_182?dchild=1&keywords=Masks&qid=1594605017&sr=8-182
Mask,,"1,447",-,https://amazon.com//Mask-Eric-Stoltz/dp/B0184MKEZG/ref=sr_1_183?dchild=1&keywords=Masks&qid=1594605017&sr=8-183
Unisex Washable Reusable Cover - 3 Layer Cover for Dust Particle & Droplet Protection - Dust Warm outdoor Cover Black - Ship From USA,15.90,34,($5.30/Count),https://amazon.com//Unisex-Washable-Reusable-Cover-Protection/dp/B088X3GWJV/ref=sr_1_184?dchild=1&keywords=Masks&qid=1594605017&sr=8-184
Allett Reusable Face Mask - 2 Pack (TIES Grey/Black),25.00,11,-,https://amazon.com//Allett-Reusable-Face-Mask-Black/dp/B089HJYGNY/ref=sr_1_185?dchild=1&keywords=Masks&qid=1594605017&sr=8-185
Fashion Cute Heart Face Protection - Unisex Cotton Dustproof Mouth Protection - Reusable Warm Windproof for Outdoor Activities,12.99,"1,265",($6.50/Item),https://amazon.com//Fashion-Cute-Heart-Face-Protection/dp/B085BM92CD/ref=sr_1_186?dchild=1&keywords=Masks&qid=1594605017&sr=8-186
5 pcs Fashion Unisex Washable and Reusable Cotton Face Shield,11.50,107,-,https://amazon.com//Fashion-Unisex-Washable-Reusable-Cotton/dp/B089S2SNTS/ref=sr_1_187?dchild=1&keywords=Masks&qid=1594605017&sr=8-187
"David Lerner Women's Printed Face Covering 2 Pack, Blue Zebra, One Size",28.00,9,-,https://amazon.com//David-Lerner-Womens-Printed-Covering/dp/B087YJ8Z3M/ref=sr_1_188?dchild=1&keywords=Masks&qid=1594605017&sr=8-188
"DDY (USA in Stock) Reusable Cotton Anti Dust Face Mouth for Cycling Camping Travel (Pink,3PCS (3PCS-Mixcolor)",14.99,122,-,https://amazon.com//DDY-Reusable-Cycling-Camping-3PCS-Mixcolor/dp/B089GNVL35/ref=sr_1_189?dchild=1&keywords=Masks&qid=1594605017&sr=8-189
"Mask Strap Extender Silicone Anti-Slip Ear Protection Saver for Face Mask Adjustable Ear Loops Hook Mask Strap Holder Behind Head, Relieve Pressure & Pain for Comfortable Mask Wearing, 5pcs Dark Color",8.99,48,($1.80/Count),https://amazon.com//Extender-Anti-Slip-Protection-Adjustable-Comfortable/dp/B0873CZ6G5/ref=sr_1_190?dchild=1&keywords=Masks&qid=1594605017&sr=8-190
KellyKessa 3-Ply Disposable Protection Cover (50Pack) (68-3PlyMask_50pack),23.99,111,-,https://amazon.com//KellyKessa-Disposable-Protection-50Pack-68-3PlyMask_50pack/dp/B0887RQQ93/ref=sr_1_191?dchild=1&keywords=Masks&qid=1594605017&sr=8-191
Coolibar UPF 50+ Men's Women's Blackburn UV Mask - Sun Protective,24.00,22,-,https://amazon.com//Coolibar-UPF-Unisex-Mask-Protective/dp/B01F2INNTO/ref=sr_1_192?dchild=1&keywords=Masks&qid=1594605017&sr=8-192
1 Pack Washable Reusable Black Cotton Mouth-Cover with 1 Pc Activated Carbon Filter Unisex F-a-c-e Covers Protection from Dust Pollen Pet Dander,13.99,11,-,https://amazon.com//Washable-Reusable-Mouth-Cover-Activated-Protection/dp/B08BKJW4XL/ref=sr_1_193?dchild=1&keywords=Masks&qid=1594605017&sr=8-193
"ZUBREX - Disposable Face Masks, 3-Ply for Work & Indoor and Outdoor Public Spaces, 50 pcs with Earloops (Blue)",29.99,0,-,https://amazon.com//ZUBREX-Disposable-Indoor-Outdoor-Earloops/dp/B088BYZW24/ref=sr_1_194?dchild=1&keywords=Masks&qid=1594605017&sr=8-194
"DDY Soft Cotton,Reusable and Washable Breathable（Pink,3pcs）",13.99,49,-,https://amazon.com//Cotton-Reusable-Washable-Breathable%EF%BC%88Pink-3pcs%EF%BC%89/dp/B089GQN33W/ref=sr_1_195?dchild=1&keywords=Masks&qid=1594605017&sr=8-195
"Dust mask with Filter,Sports Face Mask, 2 Filters and 2 Valves Included,Replaceable Filters and Washable Masks for Running, Cycling, Skiing Motorbikes, Outdoor Activities(Black)",18.99,112,($18.99/100 g),https://amazon.com//Included-Replaceable-Washable-Motorbikes-Activities/dp/B087389XXZ/ref=sr_1_196?dchild=1&keywords=Masks&qid=1594605017&sr=8-196
"Vanecia Disposable 3-Layers Protective Earloop Face Masks for Kids 6 Colors Pink Green Yellow White Blue, Kids Cartoon (30 pcs)",16.99,98,-,https://amazon.com//Vanecia-Disposable-3-Layers-Protective-Earloop/dp/B087JH8XVB/ref=sr_1_197?dchild=1&keywords=Masks&qid=1594605017&sr=8-197
Brixton Reversible Face Mask Olive Herringbone One Size,12.99,0,-,https://amazon.com//Brixton-Reversible-Face-Olive-Herringbone/dp/B089F958JY/ref=sr_1_198?dchild=1&keywords=Masks&qid=1594605017&sr=8-198
"Protective Covers with 4 Filter Sheet,Washable Reusable Protection Cover with 2 Breathing Valve-Black (1 Pack)",24.75,66,More Buying Choices,https://amazon.com//protectoras-protectora-reutilizable-v%C3%A1lvulas-respiraci%C3%B3n/dp/B088T6RHM6/ref=sr_1_199?dchild=1&keywords=Masks&qid=1594605017&sr=8-199
"Hatrigo Class 1 Face Mask, 50 Pcs Disposable Masks, Lightweight Dust Mask Face Covering, Protective Face Masks for Healthcare, Office, Work",23.99,41,($0.48/Count),https://amazon.com//Hatrigo-Disposable-Lightweight-Protective-Healthcare/dp/B088W1SS9P/ref=sr_1_200?dchild=1&keywords=Masks&qid=1594605017&sr=8-200
"Adults Cotton Face Mucks Bandanas for Men Women, Dust-Proof, 4 Pcs Facial Protective, 24 Pcs Replacement Particles Filter Breathing Sheet",24.89,2,($0.89/Count),https://amazon.com//gp/slredirect/picassoRedirect.html/ref=pa_sp_btf_aps_sr_pg4_1?ie=UTF8&adId=A07890321KIFS02T7O0R1&url=%2FDust-Proof-Protective-Replacement-Particles-Breathing%2Fdp%2FB088QYLNBB%2Fref%3Dsr_1_201_sspa%3Fdchild%3D1%26keywords%3DMasks%26qid%3D1594605017%26sr%3D8-201-spons%26psc%3D1&qualifier=1594605018&id=1319490864530914&widgetName=sp_btf
"Cover for Outdoor, Sports Fashion Protection, Neutral Black dustproof Cotton, Washable, Reusable Cotton Fabric",34.99,95,($34.99/Count),https://amazon.com//gp/slredirect/picassoRedirect.html/ref=pa_sp_btf_aps_sr_pg4_1?ie=UTF8&adId=A03484353JKJGARP4IZ6S&url=%2FOutdoor-Protection-dustproof-Washable-Reusable%2Fdp%2FB088LDVPHX%2Fref%3Dsr_1_202_sspa%3Fdchild%3D1%26keywords%3DMasks%26qid%3D1594605017%26sr%3D8-202-spons%26psc%3D1&qualifier=1594605018&id=1319490864530914&widgetName=sp_btf
"Tart Collections Face Mask, Comfortable Non-Elastic Ear Loops, Washable and Reusable, Unisex, Made in USA",9.99,73,-,https://amazon.com//gp/slredirect/picassoRedirect.html/ref=pa_sp_btf_aps_sr_pg4_1?ie=UTF8&adId=A066728025M4Q11X681OO&url=%2FTart-Collections-Comfortable-Non-Elastic-Washable%2Fdp%2FB088K52XZ9%2Fref%3Dsr_1_203_sspa%3Fdchild%3D1%26keywords%3DMasks%26qid%3D1594605017%26sr%3D8-203-spons%26psc%3D1&qualifier=1594605018&id=1319490864530914&widgetName=sp_btf
"American US Flag Face Bandana Neck Gaiter, Sun UV Dust Protection Reusable Half Mask Scarf Motorcycle Balaclava for Men Women",23.99,389,-,https://amazon.com//gp/slredirect/picassoRedirect.html/ref=pa_sp_btf_aps_sr_pg4_1?ie=UTF8&adId=A04892131BVJF2BPWNSF9&url=%2FAmerican-Protection-Reusable-Motorcycle-Balaclava%2Fdp%2FB089GXPYJD%2Fref%3Dsr_1_204_sspa%3Fdchild%3D1%26keywords%3DMasks%26qid%3D1594605017%26sr%3D8-204-spons%26psc%3D1&qualifier=1594605018&id=1319490864530914&widgetName=sp_btf
"50Pcs Disposable Face Mask, 3 Layers Breathable Earlooped  Protective Masks",26.99,12,($26.99/Count),https://amazon.com//gp/slredirect/picassoRedirect.html/ref=pa_sp_atf_next_aps_sr_pg5_1?ie=UTF8&adId=A0882846NTYTRQCRW04V&url=%2FDisposable-Layers-Breathable-Earlooped-Protective%2Fdp%2FB089GYYYRJ%2Fref%3Dsr_1_193_sspa%3Fdchild%3D1%26keywords%3DMasks%26qid%3D1594605019%26sr%3D8-193-spons%26psc%3D1&qualifier=1594605021&id=8035809820063366&widgetName=sp_atf_next
"50pcs Disposable Face Mask, Facial Masks, Mouth Masks 3-Ply with Elastic Earloops, Breathable Non-woven Mouth Filter Covers for Home, Office, Outdoor - Blue",24.99,9,-,https://amazon.com//gp/slredirect/picassoRedirect.html/ref=pa_sp_atf_next_aps_sr_pg5_1?ie=UTF8&adId=A07127011JAPYE1RMVRR8&url=%2FDisposable-Elastic-Earloops-Breathable-Non-woven%2Fdp%2FB08BCBZ876%2Fref%3Dsr_1_194_sspa%3Fdchild%3D1%26keywords%3DMasks%26qid%3D1594605019%26sr%3D8-194-spons%26psc%3D1&qualifier=1594605021&id=8035809820063366&widgetName=sp_atf_next
"Tart Collections Reversible and Adjustable Face Mask, Comfortable, Soft Elastic Ear Loops, Washable and Reusable, Unisex, 95% Poly / 5% Spandex, Solarized Croco",9.99,4,-,https://amazon.com//gp/slredirect/picassoRedirect.html/ref=pa_sp_atf_next_aps_sr_pg5_1?ie=UTF8&adId=A03023662KKOY05CTAEOF&url=%2FTart-Collections-Reversible-Adjustable-Comfortable%2Fdp%2FB0897LK9NS%2Fref%3Dsr_1_195_sspa%3Fdchild%3D1%26keywords%3DMasks%26qid%3D1594605019%26sr%3D8-195-spons%26psc%3D1&qualifier=1594605021&id=8035809820063366&widgetName=sp_atf_next
KellyKessa 3-Ply Disposable Protection Cover (50Pack) (3PlyMask_50pack),24.99,26,($24.99/Count),https://amazon.com//gp/slredirect/picassoRedirect.html/ref=pa_sp_atf_next_aps_sr_pg5_1?ie=UTF8&adId=A0516676JDTM769WJ79C&url=%2FKellyKessa-Disposable-Protection-50Pack-3PlyMask_50pack%2Fdp%2FB089T2S19H%2Fref%3Dsr_1_196_sspa%3Fdchild%3D1%26keywords%3DMasks%26qid%3D1594605019%26sr%3D8-196-spons%26psc%3D1&qualifier=1594605021&id=8035809820063366&widgetName=sp_atf_next
Unisex Washable Reusable Cover - 3 Layer Cover for Dust Particle & Droplet Protection - Dust Warm outdoor Cover Black - Ship From USA,15.90,34,($5.30/Count),https://amazon.com//Unisex-Washable-Reusable-Cover-Protection/dp/B088X3GWJV/ref=sr_1_197?dchild=1&keywords=Masks&qid=1594605019&sr=8-197
Allett Reusable Face Mask - 2 Pack (TIES Grey/Black),25.00,11,-,https://amazon.com//Allett-Reusable-Face-Mask-Black/dp/B089HJYGNY/ref=sr_1_198?dchild=1&keywords=Masks&qid=1594605019&sr=8-198
Fashion Cute Heart Face Protection - Unisex Cotton Dustproof Mouth Protection - Reusable Warm Windproof for Outdoor Activities,12.99,"1,265",($6.50/Item),https://amazon.com//Fashion-Cute-Heart-Face-Protection/dp/B085BM92CD/ref=sr_1_199?dchild=1&keywords=Masks&qid=1594605019&sr=8-199
Amazon Essentials Men's Regular-Fit Long-Sleeve Plaid Flannel Shirt,18.00,"5,731",-,https://amazon.com//Amazon-Essentials-Regular-Fit-Long-Sleeve-XX-Large/dp/B073XP65KN/ref=sr_1_200?dchild=1&keywords=Masks&qid=1594605019&sr=8-200
5 pcs Fashion Unisex Washable and Reusable Cotton Face Shield,11.50,107,-,https://amazon.com//Fashion-Unisex-Washable-Reusable-Cotton/dp/B089S2SNTS/ref=sr_1_201?dchild=1&keywords=Masks&qid=1594605019&sr=8-201
O'Neill Fashion Mask Camo One Size,11.00,0,-,https://amazon.com//ONeill-Fashion-Mask-Camo-Size/dp/B08BLWT8TT/ref=sr_1_202?dchild=1&keywords=Masks&qid=1594605019&sr=8-202
"DDY (USA in Stock) Reusable Cotton Anti Dust Face Mouth for Cycling Camping Travel (Pink,3PCS (3PCS-Mixcolor)",14.99,122,-,https://amazon.com//DDY-Reusable-Cycling-Camping-3PCS-Mixcolor/dp/B089GNVL35/ref=sr_1_203?dchild=1&keywords=Masks&qid=1594605019&sr=8-203
"Mask Strap Extender Silicone Anti-Slip Ear Protection Saver for Face Mask Adjustable Ear Loops Hook Mask Strap Holder Behind Head, Relieve Pressure & Pain for Comfortable Mask Wearing, 5pcs Dark Color",8.99,48,($1.80/Count),https://amazon.com//Extender-Anti-Slip-Protection-Adjustable-Comfortable/dp/B0873CZ6G5/ref=sr_1_204?dchild=1&keywords=Masks&qid=1594605019&sr=8-204
KellyKessa 3-Ply Disposable Protection Cover (50Pack) (68-3PlyMask_50pack),23.99,111,-,https://amazon.com//KellyKessa-Disposable-Protection-50Pack-68-3PlyMask_50pack/dp/B0887RQQ93/ref=sr_1_205?dchild=1&keywords=Masks&qid=1594605019&sr=8-205
Dickies Men's Short-Sleeve Coverall,34.32,"3,343",-,https://amazon.com//Dickies-camisa-overol-mangas-cortas/dp/B005FXH41A/ref=sr_1_206?dchild=1&keywords=Masks&qid=1594605019&sr=8-206
1 Pack Washable Reusable Black Cotton Mouth-Cover with 1 Pc Activated Carbon Filter Unisex F-a-c-e Covers Protection from Dust Pollen Pet Dander,13.99,11,-,https://amazon.com//Washable-Reusable-Mouth-Cover-Activated-Protection/dp/B08BKJW4XL/ref=sr_1_207?dchild=1&keywords=Masks&qid=1594605019&sr=8-207
Mask,,"1,447",-,https://amazon.com//Mask-Eric-Stoltz/dp/B0184MKEZG/ref=sr_1_208?dchild=1&keywords=Masks&qid=1594605019&sr=8-208
"ZUBREX - Disposable Face Masks, 3-Ply for Work & Indoor and Outdoor Public Spaces, 50 pcs with Earloops (Blue)",29.99,0,-,https://amazon.com//ZUBREX-Disposable-Indoor-Outdoor-Earloops/dp/B088BYZW24/ref=sr_1_209?dchild=1&keywords=Masks&qid=1594605019&sr=8-209
Hurley Lightweight Multipurpose Neck Gaiter with Moisture Wicking Technology (2 Pack),28.00,8,-,https://amazon.com//Hurley-Multipurpose-Moisture-Wicking-Technology/dp/B089KT2WFN/ref=sr_1_210?dchild=1&keywords=Masks&qid=1594605019&sr=8-210
"DDY Soft Cotton,Reusable and Washable Breathable（Pink,3pcs）",13.99,49,-,https://amazon.com//Cotton-Reusable-Washable-Breathable%EF%BC%88Pink-3pcs%EF%BC%89/dp/B089GQN33W/ref=sr_1_211?dchild=1&keywords=Masks&qid=1594605019&sr=8-211
"Dust mask with Filter,Sports Face Mask, 2 Filters and 2 Valves Included,Replaceable Filters and Washable Masks for Running, Cycling, Skiing Motorbikes, Outdoor Activities(Black)",18.99,112,($18.99/100 g),https://amazon.com//Included-Replaceable-Washable-Motorbikes-Activities/dp/B087389XXZ/ref=sr_1_212?dchild=1&keywords=Masks&qid=1594605019&sr=8-212
"1 PCS Washable Reusable 2 Layers Breathable Face Madks Facial M_ask C-over, G",12.99,7,-,https://amazon.com//gp/slredirect/picassoRedirect.html/ref=pa_sp_mtf_aps_sr_pg5_1?ie=UTF8&adId=A026690911WDO7T0G01ZJ&url=%2FWashable-Reusable-Layers-Breathable-Facial%2Fdp%2FB089GRF8BC%2Fref%3Dsr_1_213_sspa%3Fdchild%3D1%26keywords%3DMasks%26qid%3D1594605019%26sr%3D8-213-spons%26psc%3D1&qualifier=1594605021&id=8035809820063366&widgetName=sp_mtf
"YOUNG LOVE Summer Reusable Face Madks, Adjustable Ear Loop Face Face s-hilled, 2 ply Breathable Mouth C-Over,1 pc Camo Pink",13.99,21,-,https://amazon.com//gp/slredirect/picassoRedirect.html/ref=pa_sp_mtf_aps_sr_pg5_1?ie=UTF8&adId=A00198973HYL0BZFPYEZQ&url=%2FYOUNG-LOVE-Reusable-Adjustable-Breathable%2Fdp%2FB089FCCRVG%2Fref%3Dsr_1_214_sspa%3Fdchild%3D1%26keywords%3DMasks%26qid%3D1594605019%26sr%3D8-214-spons%26psc%3D1&qualifier=1594605021&id=8035809820063366&widgetName=sp_mtf
"LRKC Cycling Face Cover, Activated Carbon Windproof Madks with F-ilter for Outdoor Sportswear",47.99,8,-,https://amazon.com//gp/slredirect/picassoRedirect.html/ref=pa_sp_mtf_aps_sr_pg5_1?ie=UTF8&adId=A00635873U2FSB7GDZ8YE&url=%2Fdp%2FB08CK9WRP4%2Fref%3Dsr_1_215_sspa%3Fdchild%3D1%26keywords%3DMasks%26qid%3D1594605019%26sr%3D8-215-spons%26psc%3D1&qualifier=1594605021&id=8035809820063366&widgetName=sp_mtf
"3 PCS Women Men 2 Layer Breathable Reusable Cloth Face Madks, Multi3",23.99,3,-,https://amazon.com//gp/slredirect/picassoRedirect.html/ref=pa_sp_mtf_aps_sr_pg5_1?ie=UTF8&adId=A02500203IFKHE6G6SNFK&url=%2FWomen-Layer-Breathable-Reusable-Multi3%2Fdp%2FB08BRDFL9Z%2Fref%3Dsr_1_216_sspa%3Fdchild%3D1%26keywords%3DMasks%26qid%3D1594605019%26sr%3D8-216-spons%26psc%3D1&qualifier=1594605021&id=8035809820063366&widgetName=sp_mtf
"Vanecia Disposable 3-Layers Protective Earloop Face Masks for Kids 6 Colors Pink Green Yellow White Blue, Kids Cartoon (30 pcs)",16.99,98,-,https://amazon.com//Vanecia-Disposable-3-Layers-Protective-Earloop/dp/B087JH8XVB/ref=sr_1_217?dchild=1&keywords=Masks&qid=1594605019&sr=8-217
5 Pack Fashion PPE Masks,28.00,0,-,https://amazon.com//5-Pack-Fashion-PPE-Masks/dp/B08B6ZXXK4/ref=sr_1_218?dchild=1&keywords=Masks&qid=1594605019&sr=8-218
"Protective Covers with 4 Filter Sheet,Washable Reusable Protection Cover with 2 Breathing Valve-Black (1 Pack)",24.75,66,More Buying Choices,https://amazon.com//protectoras-protectora-reutilizable-v%C3%A1lvulas-respiraci%C3%B3n/dp/B088T6RHM6/ref=sr_1_219?dchild=1&keywords=Masks&qid=1594605019&sr=8-219
"Hatrigo Class 1 Face Mask, 50 Pcs Disposable Masks, Lightweight Dust Mask Face Covering, Protective Face Masks for Healthcare, Office, Work",23.99,41,($0.48/Count),https://amazon.com//Hatrigo-Disposable-Lightweight-Protective-Healthcare/dp/B088W1SS9P/ref=sr_1_220?dchild=1&keywords=Masks&qid=1594605019&sr=8-220
Aztec Secret – Indian Healing Clay 1 lb – Deep Pore Cleansing Facial & Body Mask – The Original 100% Natural Calcium Bentonite Clay – New Version 2,12.79,"5,537",($0.80/Ounce),https://amazon.com//Aztec-Secret-Cleansing-Original-Bentonite/dp/B081FK6L1G/ref=sr_1_221?dchild=1&keywords=Masks&qid=1594605019&sr=8-221
Disguise Richard Nixon Mask,14.99,150,-,https://amazon.com//Disguise-Nixon-Vinyl-Black-White/dp/B00001QHXX/ref=sr_1_222?dchild=1&keywords=Masks&qid=1594605019&sr=8-222
"Tart Collections Reversible and Adjustable Face Mask, Comfortable, Soft Elastic Ear Loops, Washable and Reusable, Unisex, 95% Rayon / 5% Spandex, Olive Camo",9.99,5,-,https://amazon.com//gp/slredirect/picassoRedirect.html/ref=pa_sp_atf_next_aps_sr_pg6_1?ie=UTF8&adId=A03021222Z1YF2EAHH4FN&url=%2FTart-Collections-Reversible-Adjustable-Comfortable%2Fdp%2FB0896QBKQG%2Fref%3Dsr_1_241_sspa%3Fdchild%3D1%26keywords%3DMasks%26qid%3D1594605021%26sr%3D8-241-spons%26psc%3D1&qualifier=1594605023&id=3877147551538419&widgetName=sp_atf_next
"20PCS, 5-layer filter, dustproof, anti-spray, anti-pollen, anti-fog,",42.99,0,-,https://amazon.com//gp/slredirect/picassoRedirect.html/ref=pa_sp_atf_next_aps_sr_pg6_1?ie=UTF8&adId=A0214930MZIIFJ6E8KZ4&url=%2F5-layer-dustproof-anti-spray-anti-pollen-anti-fog%2Fdp%2FB087W4Q34N%2Fref%3Dsr_1_242_sspa%3Fdchild%3D1%26keywords%3DMasks%26qid%3D1594605021%26sr%3D8-242-spons%26psc%3D1&qualifier=1594605023&id=3877147551538419&widgetName=sp_atf_next
"Facial Protection Filtration 95%, Anti-Fog, Dust-Proof With activated carbon filter Adjustable Headgear Nose wire Full Face Protection Masks",14.98,73,-,https://amazon.com//gp/slredirect/picassoRedirect.html/ref=pa_sp_atf_next_aps_sr_pg6_1?ie=UTF8&adId=A01098662SQMYEVMJTFMZ&url=%2FProtection-Filtration-Dust-Proof-activated-Adjustable%2Fdp%2FB089DNRJ1F%2Fref%3Dsr_1_243_sspa%3Fdchild%3D1%26keywords%3DMasks%26qid%3D1594605021%26sr%3D8-243-spons%26psc%3D1&qualifier=1594605023&id=3877147551538419&widgetName=sp_atf_next
"American US Flag Face Bandana Neck Gaiter, Sun UV Dust Protection Reusable Half Mask Scarf Motorcycle Balaclava for Men Women",32.99,389,-,https://amazon.com//gp/slredirect/picassoRedirect.html/ref=pa_sp_atf_next_aps_sr_pg6_1?ie=UTF8&adId=A04891131X3H38ECWAOM1&url=%2FAmerican-Protection-Reusable-Motorcycle-Balaclava%2Fdp%2FB088GRTRX3%2Fref%3Dsr_1_244_sspa%3Fdchild%3D1%26keywords%3DMasks%26qid%3D1594605021%26sr%3D8-244-spons%26psc%3D1&qualifier=1594605023&id=3877147551538419&widgetName=sp_atf_next
"iHeartRaves Face Mask Seamless Bandanas, 12-in-1 Multifunctional Dust Protection",29.95,351,-,https://amazon.com//iHeartRaves-Nocturnal-Galaxy-Seamless-Bandanas/dp/B07MLGLHG3/ref=sr_1_245?dchild=1&keywords=Masks&qid=1594605021&sr=8-245
20PCS PCS Adult PM2.5 Activated Carbon Filter 5 Layers Replaceable Anti Haze Filter Paper (20PCS),16.95,61,-,https://amazon.com//Activated-Carbon-Filter-Layers-Replaceable/dp/B0885RLPSC/ref=sr_1_246?dchild=1&keywords=Masks&qid=1594605021&sr=8-246
"1 PCS Cover with 8 PCS Filters and 4 Valves Included Activated Carbon Filter Elements, 5-layer Replacement Filter for Sports Outdoor Activities, Cycling, Motorcycle, Running",29.99,9,-,https://amazon.com//Included-Activated-Replacement-Activities-Motorcycle/dp/B089VR75QD/ref=sr_1_247?dchild=1&keywords=Masks&qid=1594605021&sr=8-247
Protective Mouth Cover Face Mask Multi Layer Breathable Reusable and Washable Cloth for Individual and Family Use for Indoor Outdoor Home Office Travel (3 Pack),21.17,548,($7.06/Count),https://amazon.com//Protective-Breathable-Reusable-Washable-Individual/dp/B0872TJL6R/ref=sr_1_248?dchild=1&keywords=Masks&qid=1594605021&sr=8-248
"50 Pack Disposable Face Masks with Elastic Ear Loop, 3 Ply Breathable and Comfortable for Blocking Dust Air Pollution Dust Protection (Blue)",19.88,164,($0.40/Count),https://amazon.com//Disposable-Breathable-Comfortable-Pollution-Protection/dp/B0875S5TWF/ref=sr_1_249?dchild=1&keywords=Masks&qid=1594605021&sr=8-249
Brixton Reversible Face Mask Black Engineer Stripe One Size,12.99,0,-,https://amazon.com//Brixton-Reversible-Black-Engineer-Stripe/dp/B089F8WZF4/ref=sr_1_250?dchild=1&keywords=Masks&qid=1594605021&sr=8-250
"2 layers Face Madks Reusable Washable Breathable for Adults Face Bandana scarf,Red",13.99,6,-,https://amazon.com//layers-Reusable-Washable-Breathable-Bandana/dp/B08BC9W761/ref=sr_1_251?dchild=1&keywords=Masks&qid=1594605021&sr=8-251
"20 packs of PM 2.5 activated carbon filter (5 layers), permanent household protective filter, effective non-woven cotton filter",14.59,101,-,https://amazon.com//activated-permanent-household-protective-effective/dp/B087NBBSG4/ref=sr_1_252?dchild=1&keywords=Masks&qid=1594605021&sr=8-252
