name,price,num_reviews,per_cnt_price,url,timestamp
Salon World Safety Masks - Bulk 40 Boxes (2000 Masks) in Sealed Dispenser Boxes of 50-3 Layer Disposable Protective Face Masks with Nose Clip & Ear Loops - Sanitary 3-Ply Non-Woven Fabric – Particle,729.96,0,($0.36/Mask),https://amazon.com//Salon-World-Safety-Masks-Disposable/dp/B08BQKW677/ref=sr_1_71?dchild=1&keywords=Masks&qid=1594841003&sr=8-71,2020-07-15 15:23:30
"Face Mask, Pack of 50",29.99,573,($0.60/Item),https://amazon.com//Face-Mask-Pack-of-50/dp/B086RP7G38/ref=sr_1_72?dchild=1&keywords=Masks&qid=1594841003&sr=8-72,2020-07-15 15:23:30
Unisex outdoor sports summer washable and reusable comfortable dust cover,27.89,83,-,https://amazon.com//Polyester-Washable-Dustproof-Anti-pollen-Pollution/dp/B08BKYPNXF/ref=sr_1_73?dchild=1&keywords=Masks&qid=1594841003&sr=8-73,2020-07-15 15:23:30
"Fruit of the Loom Reusable Cotton Face Mask (Packs of 50, 100, and 250)",52.19,146,-,https://amazon.com//Fruit-Loom-Reusable-Cotton-Face-Mask/dp/B086ZHZY6T/ref=sr_1_74?dchild=1&keywords=Masks&qid=1594841003&sr=8-74,2020-07-15 15:23:30
"Tart Collections Reversible and Adjustable Face Mask, Comfortable, Soft Elastic Ear Loops, Washable and Reusable, Unisex, 95% Poly / 5% Spandex, Black/White Dot",9.99,9,-,https://amazon.com//Tart-Collections-Reversible-Adjustable-Comfortable/dp/B08972D7W9/ref=sr_1_75?dchild=1&keywords=Masks&qid=1594841003&sr=8-75,2020-07-15 15:23:30
Unisex Washable and Reusable Cotton Warm Face Protection for Outdoor,12.99,337,($6.50/Count),https://amazon.com//Unisex-Washable-Reusable-Protection-Outdoor/dp/B088FVJTXG/ref=sr_1_76?dchild=1&keywords=Masks&qid=1594841003&sr=8-76,2020-07-15 15:23:30
"5 Pack Fashion Protective, Unisex Black Dust Cotton, Washable, Reusable Cotton Fabric",19.95,196,($3.99/Count),https://amazon.com//Fashion-Protective-Unisex-Washable-Reusable/dp/B089R31T4K/ref=sr_1_77?dchild=1&keywords=Masks&qid=1594841003&sr=8-77,2020-07-15 15:23:30
Face Masks 3 Ply Masks Blue 50 Pieces/Box,29.99,80,More Buying Choices,https://amazon.com//Face-Masks-Ply-Blue-Pieces/dp/B087RPM1C1/ref=sr_1_78?dchild=1&keywords=Masks&qid=1594841003&sr=8-78,2020-07-15 15:23:30
4 Pack Cotton Mouth Face Masks Mouth Cover for Men and Women (Black),10.99,748,($2.75/Item),https://amazon.com//Pangda-Anti-dust-Cotton-Mouth-Masks/dp/B0757JX2Y4/ref=sr_1_79?dchild=1&keywords=Masks&qid=1594841003&sr=8-79,2020-07-15 15:23:30
"face and Neck Protectors for Men and Women Motorcycle Riding mask Turban， Multi-Functional Seamless Ultra-fine ice Silk UV Protection, dustproof（1 Pcs）",12.99,12,-,https://amazon.com//gp/slredirect/picassoRedirect.html/ref=pa_sp_mtf_aps_sr_pg2_1?ie=UTF8&adId=A06183562C2YV37OKPRG5&url=%2FProtectors-Motorcycle-Multi-Functional-Ultra-fine-dustproof%25EF%25BC%25881%2Fdp%2FB08CNDQPBG%2Fref%3Dsr_1_80_sspa%3Fdchild%3D1%26keywords%3DMasks%26qid%3D1594841003%26sr%3D8-80-spons%26psc%3D1&qualifier=1594841009&id=369805706040215&widgetName=sp_mtf,2020-07-15 15:23:30
"Designer Cotton Reusable Face Mask - Protective Fabric Face Cover Piece Set, Washable & Breathable Mouth Mask (3)",17.99,0,($6.00/Item),https://amazon.com//gp/slredirect/picassoRedirect.html/ref=pa_sp_mtf_aps_sr_pg2_1?ie=UTF8&adId=A02676363BUP7JCR1WZMA&url=%2FDesigner-Cotton-Reusable-Face-Mask%2Fdp%2FB08BJDK81W%2Fref%3Dsr_1_81_sspa%3Fdchild%3D1%26keywords%3DMasks%26qid%3D1594841003%26sr%3D8-81-spons%26psc%3D1&qualifier=1594841009&id=369805706040215&widgetName=sp_mtf,2020-07-15 15:23:30
3-Layer Protection Face Masks(50 Pieces/Box),26.99,3,-,https://amazon.com//gp/slredirect/picassoRedirect.html/ref=pa_sp_mtf_aps_sr_pg2_1?ie=UTF8&adId=A10118331EGHUWQO7S1JK&url=%2F3-Layer-Protection-Face-Masks-Pieces%2Fdp%2FB089YVFRXW%2Fref%3Dsr_1_82_sspa%3Fdchild%3D1%26keywords%3DMasks%26qid%3D1594841003%26sr%3D8-82-spons%26psc%3D1&qualifier=1594841009&id=369805706040215&widgetName=sp_mtf,2020-07-15 15:23:30
"Grove Mask Sports Mask w/ 7X Filters – Reusable Cloth Face Mask for Cycling, Running, Training, Motorcycle – Breathable, Lightweight, Washable",29.99,0,-,https://amazon.com//Grove-Mask-Face-PM2-5-Filters/dp/B08BB1C8PP/ref=sr_1_83?dchild=1&keywords=Masks&qid=1594841003&sr=8-83,2020-07-15 15:23:30
Mask,,"1,453",-,https://amazon.com//Eric-Stoltz/dp/B0184MMM24/ref=sr_1_84?dchild=1&keywords=Masks&qid=1594841003&sr=8-84,2020-07-15 15:23:30
Snoozies 3 Layer Face Covering for Women & Men - Washable Face Covering - Reusable Face Covering - Flexible Nose Bridge - Adjustable Ear Bands - 4 Disposable Insert Filters Included - Zebra Print,14.99,3,-,https://amazon.com//Snoozies-Layer-Face-Covering-Women/dp/B089C2KHTB/ref=sr_1_85?dchild=1&keywords=Masks&qid=1594841003&sr=8-85,2020-07-15 15:23:30
Inspire Masks Reusable Face Mask with PM 2.5 Filters -Designer Washable Double-Layer Poly/Cotton Mask with 4 Replaceable Carbon Filters Included and Adjustable Elastic Ear Strap (Pink),17.99,192,($17.99/Count),https://amazon.com//Reusable-Designer-Double-Layer-Replaceable-Adjustable/dp/B087NBNTT9/ref=sr_1_86?dchild=1&keywords=Masks&qid=1594841003&sr=8-86,2020-07-15 15:23:30
"HONYAO Reusable Dust Face M Earloop Dust M, Protective M with Activated Carbon Filter and Valves for Allergy, Woodworking, Mowing, Outdoor Activities, Etc (Black)",27.88,180,-,https://amazon.com//HONYAO-Protective-Activated-Woodworking-Activities/dp/B086JXXXTK/ref=sr_1_87?dchild=1&keywords=Masks&qid=1594841003&sr=8-87,2020-07-15 15:23:30
Disposable 3 Ply Face Mask 50 Pcs (Pack) Medical Grade Non Woven 3-PLY BFE 98%,34.99,18,($0.70/Count),https://amazon.com//Disposable-Medical-Grade-Woven-3-PLY/dp/B088KSHTGF/ref=sr_1_88?dchild=1&keywords=Masks&qid=1594841003&sr=8-88,2020-07-15 15:23:30
Onzie Mindful Mask - Set of 2 Assorted One Size,23.95,14,($23.95/Item),https://amazon.com//Onzie-Mindful-Mask-Assorted-Size/dp/B086MB8Q7M/ref=sr_1_89?dchild=1&keywords=Masks&qid=1594841003&sr=8-89,2020-07-15 15:23:30
"Single Use Pullout Comfort Earloop Disposable Face Mask (Pack of 50), Blue - Latex Free",29.99,717,($0.60/Item),https://amazon.com//Single-Pullout-Comfort-Earloop-Disposable/dp/B086T5JWBQ/ref=sr_1_90?dchild=1&keywords=Masks&qid=1594841003&sr=8-90,2020-07-15 15:23:30
"UTOTEBAG Cloth Cover with Valve, Washable & Reusable Cover for Wearing",25.99,128,-,https://amazon.com//UTOTEBAG-Cloth-Washable-Reusable-Wearing/dp/B088CQYQLM/ref=sr_1_91?dchild=1&keywords=Masks&qid=1594841003&sr=8-91,2020-07-15 15:23:30
"Revman Adjustable Reusable Face Cover (Pack of 3),80% Poly Blend - Blue",13.70,994,($4.57/Item),https://amazon.com//Revman-Adjustable-Reusable-Cover-Blend/dp/B086YJDN6Z/ref=sr_1_92?dchild=1&keywords=Masks&qid=1594841003&sr=8-92,2020-07-15 15:23:30
"50pcs Disposable Face Mask, Facial Masks, Mouth Masks 3-Ply with Elastic Earloops, Breathable Non-woven Mouth Filter Covers for Home, Office, Outdoor - Blue",24.99,20,-,https://amazon.com//Disposable-Elastic-Earloops-Breathable-Non-woven/dp/B08BCBZ876/ref=sr_1_93?dchild=1&keywords=Masks&qid=1594841003&sr=8-93,2020-07-15 15:23:30
"Port Authority Reusable Face Cover (Pack of 5), White",9.06,193,($1.81/Item),https://amazon.com//Port-Authority-Reusable-Cover-White/dp/B086SB6TB5/ref=sr_1_94?dchild=1&keywords=Masks&qid=1594841003&sr=8-94,2020-07-15 15:23:30
Levi's Re-Usable Reversible Face Mask (Pack of 3),,531,-,https://amazon.com//Levis-Re-Usable-Reversible-Small-Charcoal/dp/B087YP233D/ref=sr_1_95?dchild=1&keywords=Masks&qid=1594841003&sr=8-95,2020-07-15 15:23:30
"Revman Adjustable Reusable Face Cover (Pack of 3),Cotton - Blue",13.70,239,($4.57/Item),https://amazon.com//Revman-Adjustable-Reusable-Cover-Cotton/dp/B086YJMVVK/ref=sr_1_96?dchild=1&keywords=Masks&qid=1594841003&sr=8-96,2020-07-15 15:23:30
KIDS FACE COVER MASK WITH CLEAR VISOR ELASTIC BAND AND COMFORT SPONGE ANTI DUST/FOG/SPITTING REUSABLE FACE SHIELD TRANSPARENT FOR OUTDOOR ACTIVITIES OR NURSERY AND DAYCARE CENTERS (TIGER),11.99,0,-,https://amazon.com//ELASTIC-SPITTING-REUSABLE-TRANSPARENT-ACTIVITIES/dp/B08BRJ9ZB8/ref=sr_1_97?dchild=1&keywords=Masks&qid=1594841003&sr=8-97,2020-07-15 15:23:30
"TOOCA Disposable Earloop Face Mask, Pack of 50,3-ply Mouth Mask",24.99,9,-,https://amazon.com//TOOCA-M%C3%A1scara-facial-desechable-paquete/dp/B089LZRGJ4/ref=sr_1_98?dchild=1&keywords=Masks&qid=1594841003&sr=8-98,2020-07-15 15:23:30
"Face Mask Reusable Black Cotton Masks for Face Protection Cover Washable Dust Mask for Unisex Adult Teen Kids Travel Cycling,2 Pack",12.99,378,($6.50/Count),https://amazon.com//Reusable-Cotton-Protection-Washable-Cycling/dp/B085MQKVGF/ref=sr_1_99?dchild=1&keywords=Masks&qid=1594841003&sr=8-99,2020-07-15 15:23:30
Gildan Men's Heavy Blend Fleece Hooded Sweatshirt G18500,14.50,"12,814",-,https://amazon.com//Gildan-Fleece-Sweatshirt-G18500-XX-Large/dp/B01B83Y50I/ref=sr_1_100?dchild=1&keywords=Masks&qid=1594841003&sr=8-100,2020-07-15 15:23:30
"Face Masks, Face Mouth Cover Masks, Camouflage Masks, Blue/Red/Green/Yellow, 50 Pc/Bx",29.99,6,-,https://amazon.com//Masks-Mouth-Cover-Camouflage-Yellow/dp/B0897VN7YV/ref=sr_1_101?dchild=1&keywords=Masks&qid=1594841003&sr=8-101,2020-07-15 15:23:30
"Yoodelife Anti-dust Black Mouth Mask, Unisex Cotton Face Mask Muffle Mask Anime Mask for Cycling Travel Outdoors for Adult Men Women,Style 2, Pack of 3",21.99,"1,080",($7.33/Item),https://amazon.com//Yoodelife-Anti-dust-Unisex-Cycling-Outdoors/dp/B085BNTQYS/ref=sr_1_102?dchild=1&keywords=Masks&qid=1594841003&sr=8-102,2020-07-15 15:23:30
50Pcs Disposable Filter Mask 3 Ply Earloop Face Masks,10.54,802,($0.21/Count),https://amazon.com//M%C3%A1scara-filtro-desechable-capas-unidades/dp/B085NWS77X/ref=sr_1_103?dchild=1&keywords=Masks&qid=1594841003&sr=8-103,2020-07-15 15:23:30
Face Mask Mesh with Activated Carbon Filters Dust Mask Authentic for Woodworking Construction Outdoors Indoors Travel (1 mask + 4 activated carbon filters) - Valo Products,22.99,527,($22.99/Count),https://amazon.com//Activated-Authentic-Woodworking-Construction-activated/dp/B086LHZQVF/ref=sr_1_104?dchild=1&keywords=Masks&qid=1594841003&sr=8-104,2020-07-15 15:23:30
American Mask Project Reusable Cloth Face Mask (Pack of 2),20.00,172,-,https://amazon.com//American-Mask-Project-Reusable-Cloth/dp/B0871GDS81/ref=sr_1_105?dchild=1&keywords=Masks&qid=1594841003&sr=8-105,2020-07-15 15:23:30
Beyond the Mask: How My Tragedy Sparked an Incredible Life: Lessons I Might Never Have Learned,27.00,by ,More Buying Choices,https://amazon.com//Beyond-Mask-Tragedy-Sparked-Incredible/dp/1642934186/ref=sr_1_106?dchild=1&keywords=Masks&qid=1594841003&sr=8-106,2020-07-15 15:23:30
Fashion Scarf Mask Black for Men and Women，1 mask (Cotton 100%) 2 filter chips (5 layers of effective protection),12.99,13,-,https://amazon.com//gp/slredirect/picassoRedirect.html/ref=pa_sp_btf_aps_sr_pg2_1?ie=UTF8&adId=A0198938EI909OSG8F7L&url=%2FFashion-Women%25EF%25BC%258C1-Cotton-effective-protection%2Fdp%2FB089QT1KQK%2Fref%3Dsr_1_107_sspa%3Fdchild%3D1%26keywords%3DMasks%26qid%3D1594841003%26sr%3D8-107-spons%26psc%3D1&qualifier=1594841009&id=369805706040215&widgetName=sp_btf,2020-07-15 15:23:30
"Made in USA Washable Cotton Face Mask with FILTER POCKET UNISEX Adult (Set of 3), White",18.99,1,-,https://amazon.com//gp/slredirect/picassoRedirect.html/ref=pa_sp_btf_aps_sr_pg2_1?ie=UTF8&adId=A036307621Z4JDFFH3D68&url=%2FWashable-Cotton-FILTER-POCKET-UNISEX%2Fdp%2FB0892SH3XG%2Fref%3Dsr_1_108_sspa%3Fdchild%3D1%26keywords%3DMasks%26qid%3D1594841003%26sr%3D8-108-spons%26psc%3D1&qualifier=1594841009&id=369805706040215&widgetName=sp_btf,2020-07-15 15:23:30
LRKC Mouth Cover with Activated Carbon Filter Washable Reusable Cotton for Outdoor,24.99,15,-,https://amazon.com//gp/slredirect/picassoRedirect.html/ref=pa_sp_atf_next_aps_sr_pg4_1?ie=UTF8&adId=A071241719MLW7C55MOAO&url=%2FLRKC-Unisex-Washable-Reusable-Filters%2Fdp%2FB08C9MKGPP%2Fref%3Dsr_1_145_sspa%3Fdchild%3D1%26keywords%3DMasks%26qid%3D1594841010%26sr%3D8-145-spons%26psc%3D1&qualifier=1594841012&id=7859270337589124&widgetName=sp_atf_next,2020-07-15 15:23:34
20 Pieces - Upgraded Type with 5 Layer Air Filter - White (Usually deliveried Within 1 Weeks) (20pcs),30.99,0,($6.20/Item),https://amazon.com//gp/slredirect/picassoRedirect.html/ref=pa_sp_atf_next_aps_sr_pg4_1?ie=UTF8&adId=A04595712M9UTW4O8FTV&url=%2F20-Pieces-Upgraded-Usually-deliveried%2Fdp%2FB08CVC4WKP%2Fref%3Dsr_1_146_sspa%3Fdchild%3D1%26keywords%3DMasks%26qid%3D1594841010%26sr%3D8-146-spons%26psc%3D1&qualifier=1594841012&id=7859270337589124&widgetName=sp_atf_next,2020-07-15 15:23:34
Activated Carbon Filters 5 Layers Replaceable Filters Paper (100 PCS),45.99,66,-,https://amazon.com//gp/slredirect/picassoRedirect.html/ref=pa_sp_atf_next_aps_sr_pg4_1?ie=UTF8&adId=A09884421OYNCBT4GU7IP&url=%2FActivated-Carbon-Filters-Layers-Replaceable%2Fdp%2FB08B5L9WJY%2Fref%3Dsr_1_147_sspa%3Fdchild%3D1%26keywords%3DMasks%26qid%3D1594841010%26sr%3D8-147-spons%26psc%3D1&qualifier=1594841012&id=7859270337589124&widgetName=sp_atf_next,2020-07-15 15:23:34
Face Masks Blue Three Layers 50 Pieces/Box by LEMSIR FBA Shipment,29.99,119,($0.60/Count),https://amazon.com//gp/slredirect/picassoRedirect.html/ref=pa_sp_atf_next_aps_sr_pg4_1?ie=UTF8&adId=A09090352H99PNI3L5SVC&url=%2FThree-Layers-Pieces-LEMSIR-Shipment%2Fdp%2FB06XNMVMHQ%2Fref%3Dsr_1_148_sspa%3Fdchild%3D1%26keywords%3DMasks%26qid%3D1594841010%26sr%3D8-148-spons%26psc%3D1&qualifier=1594841012&id=7859270337589124&widgetName=sp_atf_next,2020-07-15 15:23:34
"Novotel Mouth Face Cotton Balaclavas Reusable Fashion Cute Adjustable Half Cloth for Sports, Running，Outdoor Windproof",16.99,0,-,https://amazon.com//Novotel-Balaclavas-Adjustable-Running%EF%BC%8COutdoor-Windproof/dp/B084YWRKYL/ref=sr_1_149?dchild=1&keywords=Masks&qid=1594841010&sr=8-149,2020-07-15 15:23:34
Gildan Reusable Adult Everyday 2-Layer Cotton Face Mask (Pack of 24),20.99,127,-,https://amazon.com//Gildan-Reusable-Everyday-2-Layer-Cotton/dp/B088YV7VCF/ref=sr_1_150?dchild=1&keywords=Masks&qid=1594841010&sr=8-150,2020-07-15 15:23:34
Anti Pollution Face Cover Air Breathing Valves，Durable ABS Mask Accessories，for Most Kind of Double Air Breathing Valve Mask Valves Filter Accessories (30pcs),18.99,12,-,https://amazon.com//Pollution-Breathing-Valves%EF%BC%8CDurable-Accessories%EF%BC%8C-Accessories/dp/B089N6KWSD/ref=sr_1_151?dchild=1&keywords=Masks&qid=1594841010&sr=8-151,2020-07-15 15:23:34
VCAN 50 Pcs Disposable Earloop Face Masks (Blue),19.85,"1,187",($0.40/Item),https://amazon.com//VCAN-Disposable-Earloop-Face-Masks/dp/B086SH2J4R/ref=sr_1_152?dchild=1&keywords=Masks&qid=1594841010&sr=8-152,2020-07-15 15:23:34
"Achiou Neck Gaiter Face Scarf Mask-Dust, Sun Protection Cool Lightweight Windproof, Breathable Fishing Hiking Running Cycling",12.95,"2,814",-,https://amazon.com//Polainas-protecci%C3%B3n-transpirable-senderismo-ciclismo/dp/B07T4V86LW/ref=sr_1_153?dchild=1&keywords=Masks&qid=1594841010&sr=8-153,2020-07-15 15:23:34
"2 Pack Reusable Cotton Cover with 4 Breathing Valve, Loisuzn Washable Cotton Cloth Adjustable Ear Loops with 4 Pcs Filters for Men and Women - Black",19.99,32,-,https://amazon.com//Reusable-Breathing-Loisuzn-Washable-Adjustable/dp/B08964XNJ8/ref=sr_1_154?dchild=1&keywords=Masks&qid=1594841010&sr=8-154,2020-07-15 15:23:34
The Mask: A Thriller,8.99,by ,Other formats: ,https://amazon.com//Mask-Thriller-Dean-Koontz-ebook/dp/B0074VTH4I/ref=sr_1_155?dchild=1&keywords=Masks&qid=1594841010&sr=8-155,2020-07-15 15:23:34
30 PCS Adult PM2.5 Activated Carbon Filter 5 Layers Replaceable Anti Haze Filter Paper,21.95,122,More Buying Choices,https://amazon.com//Activated-Carbon-Filter-Layers-Replaceable/dp/B087D1KY66/ref=sr_1_156?dchild=1&keywords=Masks&qid=1594841010&sr=8-156,2020-07-15 15:23:34
Face Bandanas Cotton With Activated Carbon Filter Replaceable Filters Haze Dust(4PC+10filters),8.19,701,More Buying Choices,https://amazon.com//Bandanas-Breathing-Activated-Replaceable-Filters/dp/B087TSDLFF/ref=sr_1_157?dchild=1&keywords=Masks&qid=1594841010&sr=8-157,2020-07-15 15:23:34
"50pcs Disposable Másk 3 Layer Face Cover with Safety Certification Instructions Animal Pattern Face Respirator for Kids Adults (50pcs, Green)",15.88,21,-,https://amazon.com//Disposable-Certification-Instructions-Pattern-Respirator/dp/B086MT9LMH/ref=sr_1_158?dchild=1&keywords=Masks&qid=1594841010&sr=8-158,2020-07-15 15:23:34
Eddie Bauer Mens Multiclava,12.99,116,-,https://amazon.com//Eddie-Bauer-Multiclava-Scarlet-Regular/dp/B07M6FXW91/ref=sr_1_159?dchild=1&keywords=Masks&qid=1594841010&sr=8-159,2020-07-15 15:23:34
"USA Cloth Face Mask, 100% Cotton Adult Face Mask, Double Layers with Filter Pocket and Nose Wire Bridge, Reusable & Washable - Made in USA",14.50,20,($14.50/Count),https://amazon.com//Cotton-Double-Layers-Reusable-Washable/dp/B08741VZR4/ref=sr_1_160?dchild=1&keywords=Masks&qid=1594841010&sr=8-160,2020-07-15 15:23:34
"3 PCS Washable Reusable Adjustable Cotton Face Madks, N2GB",31.99,87,-,https://amazon.com//gp/slredirect/picassoRedirect.html/ref=pa_sp_mtf_aps_sr_pg4_1?ie=UTF8&adId=A052421436RVAY7A69Z9H&url=%2FWashable-Reusable-Adjustable-Cotton-Madks%2Fdp%2FB089SRP6GV%2Fref%3Dsr_1_161_sspa%3Fdchild%3D1%26keywords%3DMasks%26qid%3D1594841010%26sr%3D8-161-spons%26psc%3D1&qualifier=1594841012&id=7859270337589124&widgetName=sp_mtf,2020-07-15 15:23:34
"Tart Collections Face Mask, Comfortable Non-Elastic Ear Loops, Washable and Reusable, Unisex, Made in USA",9.99,86,-,https://amazon.com//gp/slredirect/picassoRedirect.html/ref=pa_sp_mtf_aps_sr_pg4_1?ie=UTF8&adId=A066728025M4Q11X681OO&url=%2FTart-Collections-Comfortable-Non-Elastic-Washable%2Fdp%2FB088K52XZ9%2Fref%3Dsr_1_162_sspa%3Fdchild%3D1%26keywords%3DMasks%26qid%3D1594841010%26sr%3D8-162-spons%26psc%3D1&qualifier=1594841012&id=7859270337589124&widgetName=sp_mtf,2020-07-15 15:23:34
3 Pack Face Madks Adjustable Strap 2 Layer Cloth Fabric Face Masc Reusable for Adults,21.99,3,-,https://amazon.com//gp/slredirect/picassoRedirect.html/ref=pa_sp_mtf_aps_sr_pg4_1?ie=UTF8&adId=A0061917K5HZ8W7RCUO6&url=%2FMadks-Adjustable-Fabric-Reusable-Adults%2Fdp%2FB08CRM14SD%2Fref%3Dsr_1_163_sspa%3Fdchild%3D1%26keywords%3DMasks%26qid%3D1594841010%26sr%3D8-163-spons%26psc%3D1&qualifier=1594841012&id=7859270337589124&widgetName=sp_mtf,2020-07-15 15:23:34
"50 Pcs Face Protection Masks, 5 Layer Face Protection Filtration>95% Safety Masks",130.00,6,-,https://amazon.com//Protection-Masks-Layer-Filtration-Safety/dp/B0878LZZSB/ref=sr_1_164?dchild=1&keywords=Masks&qid=1594841010&sr=8-164,2020-07-15 15:23:34
CIKIShield 5 Pack Cotton Face Mask Anti Dust Face Mask for Kids Boys Girls Cotton Rave Muffle Face Mask,23.99,198,-,https://amazon.com//Face-Cotton-Muffle-Mouth-4pack/dp/B079JVZ7J5/ref=sr_1_165?dchild=1&keywords=Masks&qid=1594841010&sr=8-165,2020-07-15 15:23:34
(20 PCS) OUBA Activated Carbon Filters Meltblown Non-Woven Cloth 5 Layers Filters,15.99,107,-,https://amazon.com//filtros-carb%C3%B3n-activado-tejida-capas/dp/B0872X1D87/ref=sr_1_166?dchild=1&keywords=Masks&qid=1594841010&sr=8-166,2020-07-15 15:23:34
Doublju Unisex Seamless Face Mask & Bandanas for Dust Outdoors Sports,15.99,7,-,https://amazon.com//Doublju-Unisex-Seamless-Bandanas-Outdoors/dp/B0872NYY6C/ref=sr_1_167?dchild=1&keywords=Masks&qid=1594841010&sr=8-167,2020-07-15 15:23:34
30pack PM 2.5 Activated Carbon Filter Insert Ship from USA,21.99,111,-,https://amazon.com//30pack-Activated-Carbon-Filter-Insert/dp/B087NDCD1P/ref=sr_1_168?dchild=1&keywords=Masks&qid=1594841010&sr=8-168,2020-07-15 15:23:34
"50 Pcs Disposable Face Mask 3-Ply Breathable & Comfortable Filter Safety Mask, Protective Blue Masks for Indoor and Outdoor",25.49,30,-,https://amazon.com//Disposable-Breathable-Comfortable-Protective-Outdoor/dp/B089ZVW3PX/ref=sr_1_169?dchild=1&keywords=Masks&qid=1594841010&sr=8-169,2020-07-15 15:23:34
5 Layer Protection Breathable Face Mask (5 pcs) – Filtration>95% with Comfortable Elastic Ear Loop | Non-Woven Polypropylene Fabric,24.99,51,-,https://amazon.com//Layer-Protection-Breathable-Face-Mask/dp/B089QYMQVL/ref=sr_1_170?dchild=1&keywords=Masks&qid=1594841010&sr=8-170,2020-07-15 15:23:34
"50 Pcs Face Masks Disposable, Breathable 3-Layer Safety Masks with Earloop for Adults & Children",19.99,69,($0.40/Count),https://amazon.com//Disposable-Breathable-3-Layer-Earloop-Children/dp/B0888V2DMW/ref=sr_1_171?dchild=1&keywords=Masks&qid=1594841010&sr=8-171,2020-07-15 15:23:34
O'NEILL Fashion Face Mask Black One Size,10.95,0,-,https://amazon.com//ONEILL-Fashion-Face-Mask-Black/dp/B08B4LVJ5Y/ref=sr_1_172?dchild=1&keywords=Masks&qid=1594841010&sr=8-172,2020-07-15 15:23:34
"Reusable Half Face Cover, NASUM 8200 Face Cover, Paint Face Cover for Painting, Machine Polishing, Welding and Other Work Protection(Medium)",39.99,129,-,https://amazon.com//Reusable-NASUM-Painting-Polishing-Protection/dp/B086DMYSLK/ref=sr_1_173?dchild=1&keywords=Masks&qid=1594841010&sr=8-173,2020-07-15 15:23:34
"WeCare Individually Wrapped Disposable Face Masks - 50 Pack, Blue - Soft on Skin - 3 Ply Protectors with Elastic Earloops - Latex Free, Non Woven, Single Use - Effective Filtration - Retail Packaging",36.98,160,-,https://amazon.com//WeCare-Individually-Wrapped-Disposable-Masks/dp/B08914CRBT/ref=sr_1_174?dchild=1&keywords=Masks&qid=1594841010&sr=8-174,2020-07-15 15:23:34
5 Pack Fashion PPE Masks,28.00,0,-,https://amazon.com//5-Pack-Fashion-PPE-Masks/dp/B08B6ZXXK4/ref=sr_1_175?dchild=1&keywords=Masks&qid=1594841010&sr=8-175,2020-07-15 15:23:34
"Tart Collections Reversible and Adjustable Face Mask, Comfortable, Soft Elastic Ear Loops, Washable and Reusable, Unisex, 95% Poly / 5% Spandex, Sumi Snake",9.99,5,-,https://amazon.com//gp/slredirect/picassoRedirect.html/ref=pa_sp_mtf_aps_sr_pg4_1?ie=UTF8&adId=A0302434S3JEDETJM9M3&url=%2FTart-Collections-Reversible-Adjustable-Comfortable%2Fdp%2FB0897CNHMX%2Fref%3Dsr_1_176_sspa%3Fdchild%3D1%26keywords%3DMasks%26qid%3D1594841010%26sr%3D8-176-spons%26psc%3D1&qualifier=1594841012&id=7859270337589124&widgetName=sp_mtf,2020-07-15 15:23:34
"Facial Protection Filtration, Anti-Fog, Dust-Proof Adjustable Headgear Full Face Protection Masks",16.99,25,-,https://amazon.com//gp/slredirect/picassoRedirect.html/ref=pa_sp_mtf_aps_sr_pg4_1?ie=UTF8&adId=A08743481LDS290KH4JSU&url=%2FProtection-Filtration-Anti-Fog-Dust-Proof-Adjustable%2Fdp%2FB08BJYB1DW%2Fref%3Dsr_1_177_sspa%3Fdchild%3D1%26keywords%3DMasks%26qid%3D1594841010%26sr%3D8-177-spons%26psc%3D1&qualifier=1594841012&id=7859270337589124&widgetName=sp_mtf,2020-07-15 15:23:34
"3 PCS Washable Reusable 2 Layers Breathable Face Madks Facial M_ask C-over, BGB",22.99,8,-,https://amazon.com//gp/slredirect/picassoRedirect.html/ref=pa_sp_mtf_aps_sr_pg4_1?ie=UTF8&adId=A02905611ZYA5V0JFK34E&url=%2FWashable-Reusable-Layers-Breathable-Facial%2Fdp%2FB089GQT2GN%2Fref%3Dsr_1_178_sspa%3Fdchild%3D1%26keywords%3DMasks%26qid%3D1594841010%26sr%3D8-178-spons%26psc%3D1&qualifier=1594841012&id=7859270337589124&widgetName=sp_mtf,2020-07-15 15:23:34
"20PCS Magicare 4-Ply Material Protection High Efficiency of Filtration, 3D Design for Better Fit the Face Contours (Ship from US)",15.50,7,-,https://amazon.com//Magicare-Material-Protection-Efficiency-Filtration/dp/B08B6Z64GX/ref=sr_1_179?dchild=1&keywords=Masks&qid=1594841010&sr=8-179,2020-07-15 15:23:34
Rhinestone Fashionable Face Mask,14.95,2,-,https://amazon.com//Priya-Rhinestone-Fashionable-Face-Mask/dp/B08C26HXLC/ref=sr_1_180?dchild=1&keywords=Masks&qid=1594841010&sr=8-180,2020-07-15 15:23:34
"Unisex Sports Madks Reusable Washable with Activated Carbon Filter, Black Breathable Adult Dust Face M¨¤sc Bandanas with 2 Breathing Valve and Ventilation, 5 Pack Black",68.99,30,-,https://amazon.com//Reusable-Activated-Breathable-Breathing-Ventilation/dp/B089W3B7MK/ref=sr_1_181?dchild=1&keywords=Masks&qid=1594841010&sr=8-181,2020-07-15 15:23:34
"5pc Unisex, washable and reusable",17.99,205,($3.60/Count),https://amazon.com//5pc-Unisex-washable-and-reusable/dp/B0876PXCQ2/ref=sr_1_182?dchild=1&keywords=Masks&qid=1594841010&sr=8-182,2020-07-15 15:23:34
"Facial Protection Filtration 95%, Anti-Fog, Dust-Proof With activated carbon filter Adjustable Headgear Nose wire Full Face Protection Masks",14.98,"2,951",-,https://amazon.com//Protection-Filtration-Dust-Proof-activated-Adjustable/dp/B089DNRJ1F/ref=sr_1_183?dchild=1&keywords=Masks&qid=1594841010&sr=8-183,2020-07-15 15:23:34
"Protective Covers with 4 Filter Sheet,Washable Reusable Protection Cover with 2 Breathing Valve-Black (1 Pack)",24.75,80,-,https://amazon.com//Protective-Washable-Protection-Breathing-Valve-Black/dp/B088T6RHM6/ref=sr_1_184?dchild=1&keywords=Masks&qid=1594841010&sr=8-184,2020-07-15 15:23:34
"CoolBELL Comfortable Mouth Cover (10PCS, 20PCS, 40PCS,50PCS, 60PCS, 100PCS)",17.99,445,-,https://amazon.com//CoolBELL-Comfortable-Mouth-20-PCS-3-Ply/dp/B086LDZMVS/ref=sr_1_185?dchild=1&keywords=Masks&qid=1594841010&sr=8-185,2020-07-15 15:23:34
"Fashion Protective, Unisex Black Dust Cotton, Washable, Reusable Cotton Fabric (5 pcs)",5.99,715,More Buying Choices,https://amazon.com//Fashion-Protective-Unisex-Washable-Reusable/dp/B088C3M9N6/ref=sr_1_186?dchild=1&keywords=Masks&qid=1594841010&sr=8-186,2020-07-15 15:23:34
KellyKessa 3-Ply Disposable Protection Cover (50Pack) (68-3PlyMask_50pack),21.99,114,-,https://amazon.com//KellyKessa-Disposable-Protection-50Pack-68-3PlyMask_50pack/dp/B0887RQQ93/ref=sr_1_187?dchild=1&keywords=Masks&qid=1594841010&sr=8-187,2020-07-15 15:23:34
Coolibar UPF 50+ Men's Women's Blackburn UV Mask - Sun Protective,24.00,9,-,https://amazon.com//Coolibar-UPF-Unisex-Mask-Protective/dp/B01F2INT66/ref=sr_1_188?dchild=1&keywords=Masks&qid=1594841010&sr=8-188,2020-07-15 15:23:34
"Children's Protective Disposable Face Bandanas, Cartoon Dinosaur Print, 3-Ply Ear Loop, 50PC (A 50pcs)",9.89,14,More Buying Choices,https://amazon.com//Childrens-Protective-Disposable-Bandanas-Dinosaur/dp/B08917VVSG/ref=sr_1_189?dchild=1&keywords=Masks&qid=1594841010&sr=8-189,2020-07-15 15:23:34
"PJ Masks, Volume 5",1.99,1,-,https://amazon.com//Meet-Armadylan-Invisible-Owlette/dp/B088P96DMS/ref=sr_1_190?dchild=1&keywords=Masks&qid=1594841010&sr=8-190,2020-07-15 15:23:34
