name,price,num_reviews,per_cnt_price,url,timestamp
"Disposable Face Mask, Breathable Masks (Pack of 50)",28.99,189,($0.58/Count),https://amazon.com//gp/slredirect/picassoRedirect.html/ref=pa_sp_atf_aps_sr_pg1_1?ie=UTF8&adId=A00897123VBVNB8BN425U&url=%2FDisposable-Face-Mask-Breathable-Masks%2Fdp%2FB089HW9VSV%2Fref%3Dsr_1_1_sspa%3Fdchild%3D1%26keywords%3DMasks%26qid%3D1594841003%26sr%3D8-1-spons%26psc%3D1&qualifier=1594841003&id=8118751811044430&widgetName=sp_atf,2020-07-15 15:23:27
"Face Masks, Pack of 50, Comfortable to wear, Adult",29.98,3,($0.60/Count),https://amazon.com//gp/slredirect/picassoRedirect.html/ref=pa_sp_atf_aps_sr_pg1_1?ie=UTF8&adId=A08186131EI4O72HARKGZ&url=%2FFace-Masks-Pack-Comfortable-Adult%2Fdp%2FB08BF78VR3%2Fref%3Dsr_1_2_sspa%3Fdchild%3D1%26keywords%3DMasks%26qid%3D1594841003%26sr%3D8-2-spons%26psc%3D1&qualifier=1594841003&id=8118751811044430&widgetName=sp_atf,2020-07-15 15:23:27
"Face Mask Disposable Masks in packs of 50, 100, 250, or 500 pieces - Breathable, 3-Ply, Non-Medical bulk Masks (50 pack)",17.99,4,($0.36/Count),https://amazon.com//gp/slredirect/picassoRedirect.html/ref=pa_sp_atf_aps_sr_pg1_1?ie=UTF8&adId=A10238981HDI0MKWRUT1H&url=%2FFace-Disposable-Masks-packs-pieces%2Fdp%2FB08BX78DJD%2Fref%3Dsr_1_3_sspa%3Fdchild%3D1%26keywords%3DMasks%26qid%3D1594841003%26sr%3D8-3-spons%26psc%3D1&qualifier=1594841003&id=8118751811044430&widgetName=sp_atf,2020-07-15 15:23:27
Face Masks - 50 Pack - Comfortable to wear,34.99,8,($0.70/Count),https://amazon.com//gp/slredirect/picassoRedirect.html/ref=pa_sp_atf_aps_sr_pg1_1?ie=UTF8&adId=A0236426374NPAUE4BDPK&url=%2FFace-Masks-Pack-Comfortable-wear%2Fdp%2FB089GV9LTX%2Fref%3Dsr_1_4_sspa%3Fdchild%3D1%26keywords%3DMasks%26qid%3D1594841003%26sr%3D8-4-spons%26psc%3D1&qualifier=1594841003&id=8118751811044430&widgetName=sp_atf,2020-07-15 15:23:27
"KN95 Face Mask, Pack of 5",20.00,17,($4.00/Item),https://amazon.com//KN95-Face-Mask-Pack-5/dp/B086JBZXPT/ref=sr_1_5?dchild=1&keywords=Masks&qid=1594841003&sr=8-5,2020-07-15 15:23:27
"SupplyAID RRS-KN95-5PK KN95 Mask, Protection Against PM2.5 Dust. Pollen and Haze-Proof, 5 Pack",17.78,79,($3.56/Count),https://amazon.com//SupplyAID-RRS-KN95-5PK-Protection-Against-Haze-Proof/dp/B086JD7TKZ/ref=sr_1_6?dchild=1&keywords=Masks&qid=1594841003&sr=8-6,2020-07-15 15:23:27
"KN95 Face Mask, Pack of 10",35.55,5,($3.56/Item),https://amazon.com//KN95-Face-Mask-Pack-10/dp/B086JTS3D8/ref=sr_1_7?dchild=1&keywords=Masks&qid=1594841003&sr=8-7,2020-07-15 15:23:27
"Feradyne KN95 Mask PPE5012 GB 2626-2006, pack of 10 mask",31.27,3,($3.13/Item),https://amazon.com//Feradyne-KN95-Mask-PPE5012-2626-2006/dp/B086R883Q8/ref=sr_1_8?dchild=1&keywords=Masks&qid=1594841003&sr=8-8,2020-07-15 15:23:27
"KN95 Face Mask, GB2626-2006, Pack of 20",62.99,43,($3.15/Item),https://amazon.com//KN95-Face-Mask-GB2626-2006-Pack/dp/B087RJ9JCF/ref=sr_1_9?dchild=1&keywords=Masks&qid=1594841003&sr=8-9,2020-07-15 15:23:27
"KN95 Mask - Non-NIOSH Approved Respirator, pack of 50",132.15,2,($2.64/Item),https://amazon.com//KN95-Mask-Non-NIOSH-Approved-Respirator/dp/B086W7BKZZ/ref=sr_1_10?dchild=1&keywords=Masks&qid=1594841003&sr=8-10,2020-07-15 15:23:27
Kids Single Use Disposable Face Mask (Pack of 50),30.87,24,-,https://amazon.com//Kids-Single-Disposable-Face-Solid/dp/B087Z8GB88/ref=sr_1_11?dchild=1&keywords=Masks&qid=1594841003&sr=8-11,2020-07-15 15:23:27
"Wembley Unisex Laboratory-Tested Adjustable and Washable Silver Linings Face Mask with 10- Replaceable Filters, Beige, One Size",19.99,23,-,https://amazon.com//Wembley-Laboratory-Tested-Adjustable-Washable-Replaceable/dp/B0892SKYXV/ref=sr_1_12?dchild=1&keywords=Masks&qid=1594841003&sr=8-12,2020-07-15 15:23:27
Modenna Face Mask Disposable Blue 50Pcs,19.99,"3,726",($0.40/Count),https://amazon.com//Modenna-Face-Mask-Disposable-50Pcs/dp/B086HKN7SS/ref=sr_1_13?dchild=1&keywords=Masks&qid=1594841003&sr=8-13,2020-07-15 15:23:27
"5 Pack Fashion Protective, Reusable Cotton Fabric, Unisex Black Cotton, Washable",23.60,696,($4.72/Count),https://amazon.com//Fashion-Protective-Reusable-Cotton-Washable/dp/B087LXGQW6/ref=sr_1_14?dchild=1&keywords=Masks&qid=1594841003&sr=8-14,2020-07-15 15:23:27
"Face Mask, Pack of 50",29.99,"12,632",($0.60/Item),https://amazon.com//Face-Mask-Pack-of-50/dp/B086KMYNSS/ref=sr_1_15?dchild=1&keywords=Masks&qid=1594841003&sr=8-15,2020-07-15 15:23:27
"Face Mask, Pack of 50",29.99,"2,252",($0.60/Item),https://amazon.com//Face-Mask-Pack-of-50/dp/B086JBF8F3/ref=sr_1_16?dchild=1&keywords=Masks&qid=1594841003&sr=8-16,2020-07-15 15:23:27
"1 Pack Dust_mask Reusable Respirators Unisex Mouth_mask Adjustable for Allergies Woodworking,Cycling, Running,Outdoor Sports, Black with 4 Filters",17.99,57,-,https://amazon.com//gp/slredirect/picassoRedirect.html/ref=pa_sp_mtf_aps_sr_pg1_1?ie=UTF8&adId=A0031193R26GSQUUKURQ&url=%2FDust_mask-Respirators-Mouth_mask-Adjustable-Woodworking%2Fdp%2FB087LV8N93%2Fref%3Dsr_1_17_sspa%3Fdchild%3D1%26keywords%3DMasks%26qid%3D1594841003%26sr%3D8-17-spons%26psc%3D1&qualifier=1594841003&id=8118751811044430&widgetName=sp_mtf,2020-07-15 15:23:27
"Designer Cotton Reusable Face Mask - Protective Fabric Face Cover Piece Set, Washable & Breathable Mouth Mask (4)",22.99,3,($5.75/Item),https://amazon.com//gp/slredirect/picassoRedirect.html/ref=pa_sp_mtf_aps_sr_pg1_1?ie=UTF8&adId=A01977693TMZCVWOA9CZJ&url=%2FDesigner-Cotton-Reusable-Face-Mask%2Fdp%2FB08BJFZMPP%2Fref%3Dsr_1_18_sspa%3Fdchild%3D1%26keywords%3DMasks%26qid%3D1594841003%26sr%3D8-18-spons%26psc%3D1&qualifier=1594841003&id=8118751811044430&widgetName=sp_mtf,2020-07-15 15:23:27
"Pure Cotton Reusable Face Mask - Protective Fabric Face Cover 3 Piece Set, Washable & Breathable Mouth Mask (Black,White,Blue)",11.99,101,($4.00/Count),https://amazon.com//gp/slredirect/picassoRedirect.html/ref=pa_sp_mtf_aps_sr_pg1_1?ie=UTF8&adId=A1024196200P6GEZBRL6W&url=%2FPure-Cotton-Reusable-Face-Mask%2Fdp%2FB088THXCXJ%2Fref%3Dsr_1_19_sspa%3Fdchild%3D1%26keywords%3DMasks%26qid%3D1594841003%26sr%3D8-19-spons%26psc%3D1&qualifier=1594841003&id=8118751811044430&widgetName=sp_mtf,2020-07-15 15:23:27
"3ply Disposable Face Mask, 50 Count",29.99,278,($0.60/Count),https://amazon.com//3ply-Disposable-Face-Mask-Count/dp/B08852WYM2/ref=sr_1_20?dchild=1&keywords=Masks&qid=1594841003&sr=8-20,2020-07-15 15:23:27
"5 Pack Fashion Protective, Unisex Black Dust Cotton, Reusable Cotton Fabric",19.88,420,($3.98/Count),https://amazon.com//Fashion-Protective-Unisex-Cotton-Reusable/dp/B088K63VYJ/ref=sr_1_21?dchild=1&keywords=Masks&qid=1594841003&sr=8-21,2020-07-15 15:23:27
"Disposable Face Mask, Pack of 50, New Packaging",29.99,186,($0.60/Count),https://amazon.com//Disposable-Face-Mask-Pack-Packaging/dp/B088GKG1RN/ref=sr_1_22?dchild=1&keywords=Masks&qid=1594841003&sr=8-22,2020-07-15 15:23:27
"MSAAEX Disposable Face Mask for Air Pollution, Dustproof Mouth Cover, 3-ply Safety Mask (50)",19.88,255,($0.40/Count),https://amazon.com//MSAAEX-Disposable-Pollution-Dustproof-Safety/dp/B087X9RZTD/ref=sr_1_23?dchild=1&keywords=Masks&qid=1594841003&sr=8-23,2020-07-15 15:23:27
"Single Use Disposable Face Mask (Pack of 50), Blue",29.99,933,($0.60/Item),https://amazon.com//Single-Disposable-Face-Mask-Pack/dp/B086T638CS/ref=sr_1_24?dchild=1&keywords=Masks&qid=1594841003&sr=8-24,2020-07-15 15:23:27
Reusable Cotton Face Mask (Pack of 50),30.99,"1,377",-,https://amazon.com//Reusable-Cotton-Face-Mask-Pack/dp/B086WC1LDD/ref=sr_1_25?dchild=1&keywords=Masks&qid=1594841003&sr=8-25,2020-07-15 15:23:27
iHeartRaves Seamless Face Cover Mouth Mask Scarf Bandanas Neck Gaiter - Dust & UV Sun-Protection for Festivals and Outdoors,12.95,169,-,https://amazon.com//iHeartRaves-Star-Search-Seamless-Bandana/dp/B07B6963P6/ref=sr_1_26?dchild=1&keywords=Masks&qid=1594841003&sr=8-26,2020-07-15 15:23:27
"Disposable Masks, AXHKIO Disposable Breathable 3 Ply Mask, with Elastic Earloops (50 Pcs)",25.99,46,($0.52/Count),https://amazon.com//Disposable-AXHKIO-Breathable-Elastic-Earloops/dp/B0897QFZ1R/ref=sr_1_27?dchild=1&keywords=Masks&qid=1594841003&sr=8-27,2020-07-15 15:23:27
The Mask,14.99,"2,645",-,https://amazon.com//Mask-Jim-Carrey/dp/B008UCCKSU/ref=sr_1_28?dchild=1&keywords=Masks&qid=1594841003&sr=8-28,2020-07-15 15:23:27
"Dust mask with Filter,Sports Face Mask, 4 Filters and 2 Valves Included,Men's and Women's Universal Masks,Suitable for Woodworking, Outdoor Activities",24.99,26,($29.75/100 g),https://amazon.com//Included-Universal-Suitable-Woodworking-Activities/dp/B08738MMY9/ref=sr_1_29?dchild=1&keywords=Masks&qid=1594841003&sr=8-29,2020-07-15 15:23:27
INTO THE AM Seamless Face Cover Mouth Mask Scarf Bandanas Neck Gaiter - Dust & UV Sun-Protection for Festivals and Outdoors,12.95,257,-,https://amazon.com//INTO-AM-Matter-Seamless-Bandana/dp/B07B67XGS7/ref=sr_1_30?dchild=1&keywords=Masks&qid=1594841003&sr=8-30,2020-07-15 15:23:27
[Pack of 10] [CARE ON] 4-Layers ::KF94 Certified:: Face Safety Mask with Ear Loop for Adult [Individually Packaged] Comfortable & Better Protection from Fine Dust [Made in KOREA],39.99,6,($4.00/Count),https://amazon.com//Pack-CARE-4-Layers-Individually-Comfortable/dp/B08BJF9ZG4/ref=sr_1_31?dchild=1&keywords=Masks&qid=1594841003&sr=8-31,2020-07-15 15:23:27
"Cover for Outdoor, Sports Fashion Protection, Neutral Black dustproof Cotton, Washable, Reusable Cotton Fabric",34.95,105,($34.95/Count),https://amazon.com//gp/slredirect/picassoRedirect.html/ref=pa_sp_mtf_aps_sr_pg1_1?ie=UTF8&adId=A03484353JKJGARP4IZ6S&url=%2FOutdoor-Protection-dustproof-Washable-Reusable%2Fdp%2FB088LDVPHX%2Fref%3Dsr_1_32_sspa%3Fdchild%3D1%26keywords%3DMasks%26qid%3D1594841003%26sr%3D8-32-spons%26psc%3D1&qualifier=1594841003&id=8118751811044430&widgetName=sp_mtf,2020-07-15 15:23:27
"4pcsDust_mask Reusable Respirators Unisex Mouth_mask Adjustable for Allergies Woodworking,Cycling, Running,Outdoor Sports, Reusable Washable",10.99,0,($10.99/Count),https://amazon.com//gp/slredirect/picassoRedirect.html/ref=pa_sp_mtf_aps_sr_pg1_1?ie=UTF8&adId=A05175531IXOVWWH4FKWJ&url=%2F4pcsDust_mask-Respirators-Mouth_mask-Adjustable-Woodworking%2Fdp%2FB08C5HZFCW%2Fref%3Dsr_1_33_sspa%3Fdchild%3D1%26keywords%3DMasks%26qid%3D1594841003%26sr%3D8-33-spons%26psc%3D1&qualifier=1594841003&id=8118751811044430&widgetName=sp_mtf,2020-07-15 15:23:27
"3 Pack Unisex Reusable Pleated Fabric Face Mask with Adjustable Elastic, 2 Layer, Washable, Nose Wire (Size OS, 3 Pack)",17.49,39,($5.83/Count),https://amazon.com//gp/slredirect/picassoRedirect.html/ref=pa_sp_mtf_aps_sr_pg1_1?ie=UTF8&adId=A0407287303F0LY118TNF&url=%2FReusable-Pleated-Adjustable-Elastic-Washable%2Fdp%2FB089T5Z342%2Fref%3Dsr_1_34_sspa%3Fdchild%3D1%26keywords%3DMasks%26qid%3D1594841003%26sr%3D8-34-spons%26psc%3D1&qualifier=1594841003&id=8118751811044430&widgetName=sp_mtf,2020-07-15 15:23:27
Gildan Reusable Adult Tie-On Triple Layer Mask (Pack of 48),39.99,298,-,https://amazon.com//Gildan-Reusable-Adult-Triple-Layer/dp/B086QS2YHF/ref=sr_1_35?dchild=1&keywords=Masks&qid=1594841003&sr=8-35,2020-07-15 15:23:27
Disposable Face Mask - Pack of 50 - Blue,29.99,449,($0.60/Item),https://amazon.com//Disposable-Face-Mask-Pack-Blue/dp/B086MPXGKJ/ref=sr_1_36?dchild=1&keywords=Masks&qid=1594841003&sr=8-36,2020-07-15 15:23:27
Quality Durables Adults and Kids 4-Pack Reusable Face Covering,18.00,427,-,https://amazon.com//Quality-Durables-Reusable-Covering-Heather/dp/B088BWP7VH/ref=sr_1_37?dchild=1&keywords=Masks&qid=1594841003&sr=8-37,2020-07-15 15:23:27
"Disposable Face Mask, Pack of 50",29.99,219,($0.60/Item),https://amazon.com//Disposable-Face-Mask-Pack-50/dp/B0877TJL3M/ref=sr_1_38?dchild=1&keywords=Masks&qid=1594841003&sr=8-38,2020-07-15 15:23:27
"TomrickCare Face Masks, 3-Ply Breathable Masks 5 sets of 10 per Box,  Comfortable Earloops(50 Pack)",29.98,148,($0.60/Count),https://amazon.com//TomrickCare-Masks-Breathable-Comfortable-Earloops/dp/B0892T3YLS/ref=sr_1_39?dchild=1&keywords=Masks&qid=1594841003&sr=8-39,2020-07-15 15:23:27
"Levi's Men's 100% Cotton Multi-Purpose Bandana Gift Sets – Headband, Wrap, Protective Coverage",15.85,"3,157",-,https://amazon.com//Levis-Bandanas-Gift-White-Black/dp/B0765YZMZ6/ref=sr_1_40?dchild=1&keywords=Masks&qid=1594841003&sr=8-40,2020-07-15 15:23:27
50 Pcs Disposable Face Cover 3-Ply Filter Non Medical Breathable Earloop Masks (Orange),25.99,2,-,https://amazon.com//Disposable-Filter-Medical-Breathable-Earloop/dp/B08BWY3XL4/ref=sr_1_41?dchild=1&keywords=Masks&qid=1594841003&sr=8-41,2020-07-15 15:23:27
3pcs/Pack Dust Masks Breathable Reusable for Outdoor Sport Half Face Earloop Masks Dust Pollen Cotton Black Masks (Black),14.99,239,($5.00/Count),https://amazon.com//Breathable-Reusable-Outdoor-Earloop-Pollen/dp/B086R5TCNK/ref=sr_1_42?dchild=1&keywords=Masks&qid=1594841003&sr=8-42,2020-07-15 15:23:27
Reusable Face Cover (Pack of 3),16.04,780,($5.35/Item),https://amazon.com//Reusable-Face-Cover-Pack-3/dp/B086ZMN1N3/ref=sr_1_43?dchild=1&keywords=Masks&qid=1594841003&sr=8-43,2020-07-15 15:23:27
"Disposable Face Mask, ESOLOM 3-Ply Facial Cover Masks with Ear Loop, Breathable Non-Woven Mouth Cover for Personal, Suitable for Home, Office, Outdoor- 50 PCS",24.99,484,($0.50/Count),https://amazon.com//Disposable-ESOLOM-Breathable-Non-Woven-Personal/dp/B086QLH269/ref=sr_1_44?dchild=1&keywords=Masks&qid=1594841003&sr=8-44,2020-07-15 15:23:27
"Disposable Face Mask, Breathable Masks (2 x 50 Boxes) 100 count",52.99,29,($0.53/count),https://amazon.com//Disposable-Breathable-Masks-Boxes-count/dp/B08BN1YTPQ/ref=sr_1_45?dchild=1&keywords=Masks&qid=1594841003&sr=8-45,2020-07-15 15:23:27
6 Pack Fabric Face Mask Reusable Double Fabric Layers - Made in USA (6 Pack),27.99,515,($4.67/Count),https://amazon.com//Pack-Fabric-Reusable-Double-Layers/dp/B087W4D243/ref=sr_1_46?dchild=1&keywords=Masks&qid=1594841003&sr=8-46,2020-07-15 15:23:27
"50pcs Disposable Face Mask, Safty Masks, Mouth Masks 3-Ply with Elastic Earloops, Breathable Non-woven Mouth Filter Covers for Home, Office, Outdoor - White",19.98,43,($0.40/Count),https://amazon.com//Disposable-Elastic-Earloops-Breathable-Non-woven/dp/B087YWW2PL/ref=sr_1_47?dchild=1&keywords=Masks&qid=1594841003&sr=8-47,2020-07-15 15:23:27
"CKW 3 Ply Disposable Protective Mask, 50 Masks in Box, Blue, 19x10x8.8cm",28.90,629,($0.58/Count),https://amazon.com//CKW-Disposable-Protective-Masks-19x10x8-8cm/dp/B086Y21B7Z/ref=sr_1_48?dchild=1&keywords=Masks&qid=1594841003&sr=8-48,2020-07-15 15:23:27
ZUBREX Disposable 3 Ply Safety Face Mask for Protection - with Nanofiber Filter Lining - and Elastic Earloops - 50 Pcs (Blue),29.99,476,More Buying Choices,https://amazon.com//ZUBREX-Disposable-Safety-Face-Protection/dp/B088BY7YPX/ref=sr_1_49?dchild=1&keywords=Masks&qid=1594841003&sr=8-49,2020-07-15 15:23:27
"Disposable Face Masks, 3 Layers Breathable and Comfortable Elastic Ear Loop, Pack of 50 PCS",29.99,231,($0.60/Count),https://amazon.com//Disposable-Layers-Breathable-Comfortable-Elastic/dp/B088M6YFDJ/ref=sr_1_50?dchild=1&keywords=Masks&qid=1594841003&sr=8-50,2020-07-15 15:23:27
TODOLOR Face Mask 3-Layer Protective Earloop Blue 50Pcs,19.99,179,($0.40/Count),https://amazon.com//TODOLOR-3-Layer-Protective-Earloop-50Pcs/dp/B087Z5BD9H/ref=sr_1_51?dchild=1&keywords=Masks&qid=1594841003&sr=8-51,2020-07-15 15:23:27
Fashion Mouth Protection Unisex Washable and Reusable Cotton Warm Face Protection with Adjustable Bridge Design (3-Pack Black),15.69,"1,620",($5.23/Count),https://amazon.com//Fashion-Protection-Washable-Reusable-Adjustable/dp/B0855PDTYG/ref=sr_1_52?dchild=1&keywords=Masks&qid=1594841003&sr=8-52,2020-07-15 15:23:27
Fashion Cute Heart Face Protection - Unisex Cotton Dustproof Mouth Protection - Reusable Warm Windproof for Outdoor Activities,12.99,"1,348",($6.50/Item),https://amazon.com//Fashion-Cute-Heart-Face-Protection/dp/B085BM92CD/ref=sr_1_53?dchild=1&keywords=Masks&qid=1594841003&sr=8-53,2020-07-15 15:23:27
Wecolor 100 Pack 3 Ply Disposable Face Masks (Blue),42.99,"1,978",($42.99/Count),https://amazon.com//Disposable-Hypoallergenic-Breathability-Comfort-Great-Allergies/dp/B078718WVB/ref=sr_1_54?dchild=1&keywords=Masks&qid=1594841003&sr=8-54,2020-07-15 15:23:27
The Case Against Masks: Ten Reasons Why Mask Use Should be Limited,3.99,by ,Other format: ,https://amazon.com//Case-Against-Masks-Reasons-Limited-ebook/dp/B08CVSKX4L/ref=sr_1_55?dchild=1&keywords=Masks&qid=1594841003&sr=8-55,2020-07-15 15:23:27
"5 Pcs Unisex Black Dust Cotton, Washable, Reusable Cotton Fabric",19.21,96,($3.84/Count),https://amazon.com//Unisex-Cotton-Washable-Reusable-Fabric/dp/B0882S61Y9/ref=sr_1_56?dchild=1&keywords=Masks&qid=1594841003&sr=8-56,2020-07-15 15:23:27
"Universal 4521 Cloth Face Masks – Reusable Nose & Mouth Mask, 100% Cotton, 2 Layer, Washable Facemask, Teens & Adults – Protects from Dust, Pollen, Pet Dander & Other Irritants (4 Masks (1 Pkg))",16.99,"1,341",($4.25/Item),https://amazon.com//Universal-4521-Anti-Flu-Masks/dp/B07VGKQ1PV/ref=sr_1_57?dchild=1&keywords=Masks&qid=1594841003&sr=8-57,2020-07-15 15:23:27
"3 Pack Face Covering, Mouth Covering Unisex Black Dust Cotton, Washable, Reusable Cotton Fabric Dust Covering",14.99,275,-,https://amazon.com//Covering-Unisex-Cotton-Washable-Reusable/dp/B089148BWQ/ref=sr_1_58?dchild=1&keywords=Masks&qid=1594841003&sr=8-58,2020-07-15 15:23:27
"Face Masks,50 Pack/Box",29.99,1,-,https://amazon.com//gp/slredirect/picassoRedirect.html/ref=pa_sp_btf_aps_sr_pg1_1?ie=UTF8&adId=A08548033QYZLU1QQ7N55&url=%2FFace-Masks-50-Pack-Box%2Fdp%2FB089YVT3ZZ%2Fref%3Dsr_1_59_sspa%3Fdchild%3D1%26keywords%3DMasks%26qid%3D1594841003%26sr%3D8-59-spons%26psc%3D1&qualifier=1594841003&id=8118751811044430&widgetName=sp_btf,2020-07-15 15:23:27
"Face Mask Disposable Masks 50 pieces With 10 Bonus Wipes - Breathable, 3-Ply, Non-Medical bulk Masks (50 pack)",17.99,0,($0.36/Count),https://amazon.com//gp/slredirect/picassoRedirect.html/ref=pa_sp_btf_aps_sr_pg1_1?ie=UTF8&adId=A06383362SCEJ5WQRD7N4&url=%2FDisposable-Masks-pieces-Bonus-Wipes%2Fdp%2FB08C6B771X%2Fref%3Dsr_1_60_sspa%3Fdchild%3D1%26keywords%3DMasks%26qid%3D1594841003%26sr%3D8-60-spons%26psc%3D1&qualifier=1594841003&id=8118751811044430&widgetName=sp_btf,2020-07-15 15:23:27
"10PC Cotton Anti-dust Mouth Face_mask_Protect Cover Bandana Balaclavas, 2-layer Unisex Reusable Fashion Washable Cover",29.99,8,($29.99/Count),https://amazon.com//gp/slredirect/picassoRedirect.html/ref=pa_sp_atf_next_aps_sr_pg2_1?ie=UTF8&adId=A068673314IE3X8R5F7ED&url=%2FAnti-dust-Face_mask_Protect-Balaclavas-Reusable-Washable%2Fdp%2FB08BHZ5BPJ%2Fref%3Dsr_1_49_sspa%3Fdchild%3D1%26keywords%3DMasks%26qid%3D1594841003%26sr%3D8-49-spons%26psc%3D1&qualifier=1594841009&id=369805706040215&widgetName=sp_atf_next,2020-07-15 15:23:30
INTO THE AM Seamless Face Cover Mouth Mask Scarf Bandanas Neck Gaiter - Dust & UV Sun-Protection for Festivals and Outdoors,12.95,458,-,https://amazon.com//gp/slredirect/picassoRedirect.html/ref=pa_sp_atf_next_aps_sr_pg2_1?ie=UTF8&adId=A07970433MP35OZZ5IWT2&url=%2FINTO-AM-Paint-Splatter-Seamless%2Fdp%2FB07B69CFJF%2Fref%3Dsr_1_50_sspa%3Fdchild%3D1%26keywords%3DMasks%26qid%3D1594841003%26sr%3D8-50-spons%26psc%3D1&qualifier=1594841009&id=369805706040215&widgetName=sp_atf_next,2020-07-15 15:23:30
"Facial Protection Filtration 95%, Anti-Fog, Dust-Proof washable Headgear Full Face Protection Masks",16.99,55,-,https://amazon.com//gp/slredirect/picassoRedirect.html/ref=pa_sp_atf_next_aps_sr_pg2_1?ie=UTF8&adId=A0380743B4WD7QS9MITI&url=%2FProtection-Filtration-Anti-Fog-Dust-Proof-washable%2Fdp%2FB089SZKVZ3%2Fref%3Dsr_1_51_sspa%3Fdchild%3D1%26keywords%3DMasks%26qid%3D1594841003%26sr%3D8-51-spons%26psc%3D1&qualifier=1594841009&id=369805706040215&widgetName=sp_atf_next,2020-07-15 15:23:30
"Facial Protection Filtration 95%, Anti-Fog, Dust-Proof Adjustable Headgear Full Face Protection Masks",17.99,221,($17.99/Count),https://amazon.com//gp/slredirect/picassoRedirect.html/ref=pa_sp_atf_next_aps_sr_pg2_1?ie=UTF8&adId=A0210431396NKB1XYOO91&url=%2FProtection-Filtration-Anti-Fog-Dust-Proof-Adjustable%2Fdp%2FB088CQGVMJ%2Fref%3Dsr_1_52_sspa%3Fdchild%3D1%26keywords%3DMasks%26qid%3D1594841003%26sr%3D8-52-spons%26psc%3D1&qualifier=1594841009&id=369805706040215&widgetName=sp_atf_next,2020-07-15 15:23:30
"5 Pack Fashion Protective, Unisex Black Dust Cotton, Washable, Reusable Cotton Fabric",18.99,925,($3.80/Count),https://amazon.com//Fashion-Protective-Unisex-Washable-Reusable/dp/B087NMTT81/ref=sr_1_53?dchild=1&keywords=Masks&qid=1594841003&sr=8-53,2020-07-15 15:23:30
"Bloch Soft Stretch Reusable Face Mask (Pack of 3), Black, Adult",22.79,15,-,https://amazon.com//Bloch-Stretch-Reusable-Black-Adult/dp/B087M41L9Q/ref=sr_1_54?dchild=1&keywords=Masks&qid=1594841003&sr=8-54,2020-07-15 15:23:30
BASE CAMP M Plus Face Cover with Active Carbon Filter Combo Kit,39.99,85,-,https://amazon.com//BASE-CAMP-Active-Carbon-Filter/dp/B085B8Y9XH/ref=sr_1_55?dchild=1&keywords=Masks&qid=1594841003&sr=8-55,2020-07-15 15:23:30
Colbiz Dust Mask with Activated Carbon Filters Reusable Sports Face Mask,29.99,152,More Buying Choices,https://amazon.com//Colbiz-Adjustable-Breathable-Motorcycle-Woodworking/dp/B089LKF6JK/ref=sr_1_56?dchild=1&keywords=Masks&qid=1594841003&sr=8-56,2020-07-15 15:23:30
"Cover for Outdoor, Sports Fashion Protection, Neutral Black dustproof Cotton, Washable, Reusable Cotton Fabric",34.95,105,($34.95/Count),https://amazon.com//Outdoor-Protection-dustproof-Washable-Reusable/dp/B088LDVPHX/ref=sr_1_57?dchild=1&keywords=Masks&qid=1594841003&sr=8-57,2020-07-15 15:23:30
"Tart Collections Face Mask, Comfortable Non-Elastic Ear Loops, Washable and Reusable, Unisex, Made in USA",9.99,54,-,https://amazon.com//Tart-Collections-Comfortable-Non-Elastic-Washable/dp/B088JWKYFW/ref=sr_1_58?dchild=1&keywords=Masks&qid=1594841003&sr=8-58,2020-07-15 15:23:30
Hurley Lightweight Multipurpose Neck Gaiter with Moisture Wicking Technology,18.00,23,-,https://amazon.com//Hurley-Multipurpose-Moisture-Wicking-Technology/dp/B089GZMFYX/ref=sr_1_59?dchild=1&keywords=Masks&qid=1594841003&sr=8-59,2020-07-15 15:23:30
New Republic Made in USA 3 Pack Face Masks | Washable and Reusable | 2 Ply 100% Cotton | Regular Size,12.00,"2,721",($4.00/Count),https://amazon.com//New-Republic-Washable-Reusable-Regular/dp/B0876HQ55Q/ref=sr_1_60?dchild=1&keywords=Masks&qid=1594841003&sr=8-60,2020-07-15 15:23:30
"Ecnobia 3 Ply Non-Woven, 100Pcs Disposable Face Bandanas, Cloth Covering, No Washable, Breathable and Anti-Haze Dust, for Adults (100 Pcs, Gray)",16.08,51,More Buying Choices,https://amazon.com//Non-Woven-Disposable-Bandanas-Breathable-Anti-Haze/dp/B08B64DS1S/ref=sr_1_61?dchild=1&keywords=Masks&qid=1594841003&sr=8-61,2020-07-15 15:23:30
"8pack Reusable Cotton Fabric-Washable,Fashion Protective, Unisex Black Cotton",21.99,0,-,https://amazon.com//Reusable-Cotton-Fabric-Washable-Fashion-Protective/dp/B08BY8XF7Q/ref=sr_1_62?dchild=1&keywords=Masks&qid=1594841003&sr=8-62,2020-07-15 15:23:30
"Aliceva One Step Foot Peel Mask, Simple Foot Peeling Mask, Exfoliating Calluses and Dead Skin Remover - 2 Pairs",17.95,"3,386",($8.98/Count),https://amazon.com//Aliceva-Peeling-Exfoliating-Calluses-Remover/dp/B00JKOJHQ0/ref=sr_1_63?dchild=1&keywords=Masks&qid=1594841003&sr=8-63,2020-07-15 15:23:30
"Sunscreen, UV protection, sunscreen is suitable for summer cycling and hiking",17.99,352,More Buying Choices,https://amazon.com//Sunscreen-protection-sunscreen-suitable-cycling/dp/B086S5DRDP/ref=sr_1_64?dchild=1&keywords=Masks&qid=1594841003&sr=8-64,2020-07-15 15:23:30
"FAEUYUSO 10 PC Facial Protection, with 20 Filters and 10 PC Hook, Reusable Washable Adjustable Nose Wire Headgear Full Face Protection Masks",24.99,0,-,https://amazon.com//gp/slredirect/picassoRedirect.html/ref=pa_sp_mtf_aps_sr_pg2_1?ie=UTF8&adId=A0212032361ASSWIPJ83A&url=%2FFAEUYUSO-Protection-Reusable-Washable-Adjustable%2Fdp%2FB08CBGB6XV%2Fref%3Dsr_1_65_sspa%3Fdchild%3D1%26keywords%3DMasks%26qid%3D1594841003%26sr%3D8-65-spons%26psc%3D1&qualifier=1594841009&id=369805706040215&widgetName=sp_mtf,2020-07-15 15:23:30
"Tart Collections Face Mask, Comfortable Non-Elastic Ear Loops, Washable and Reusable, Unisex, Made in USA",9.99,64,-,https://amazon.com//gp/slredirect/picassoRedirect.html/ref=pa_sp_mtf_aps_sr_pg2_1?ie=UTF8&adId=A08079862SNRKBK04ZGE9&url=%2FTart-Collections-Comfortable-Non-Elastic-Washable%2Fdp%2FB088K9CQSY%2Fref%3Dsr_1_66_sspa%3Fdchild%3D1%26keywords%3DMasks%26qid%3D1594841003%26sr%3D8-66-spons%26psc%3D1&qualifier=1594841009&id=369805706040215&widgetName=sp_mtf,2020-07-15 15:23:30
iHeartRaves Seamless Face Cover Mouth Mask Scarf Bandanas Neck Gaiter - Dust & UV Sun-Protection for Festivals and Outdoors,12.95,448,-,https://amazon.com//gp/slredirect/picassoRedirect.html/ref=pa_sp_mtf_aps_sr_pg2_1?ie=UTF8&adId=A08532587S1NWJOC3U6C&url=%2FiHeartRaves-Constellations-Galaxy-Seamless-Bandana%2Fdp%2FB075NVVN55%2Fref%3Dsr_1_67_sspa%3Fdchild%3D1%26keywords%3DMasks%26qid%3D1594841003%26sr%3D8-67-spons%26psc%3D1&qualifier=1594841009&id=369805706040215&widgetName=sp_mtf,2020-07-15 15:23:30
"Facial Protection Filtration, Anti-Fog, Dust-Proof Adjustable Headgear Full Face Protection Masks（1 pcs）",9.99,12,-,https://amazon.com//Protection-Filtration-Anti-Fog-Dust-Proof-Adjustable/dp/B08CNDLH13/ref=sr_1_68?dchild=1&keywords=Masks&qid=1594841003&sr=8-68,2020-07-15 15:23:30
FASHIONOLIC Fashion Cloth Face Mask Cotton Thin Breathable Washable Reusable Camo Animal Black Made in USA,18.99,487,More Buying Choices,https://amazon.com//FASHIONOLIC-Fashion-Breathable-Washable-Reusable/dp/B086HF4P4M/ref=sr_1_69?dchild=1&keywords=Masks&qid=1594841003&sr=8-69,2020-07-15 15:23:30
"Amazon Essentials Men's Slim-Fit 9"" Short",15.00,"2,120",-,https://amazon.com//Amazon-Essentials-Slim-Fit-Washed-Lobster/dp/B07F283XP7/ref=sr_1_70?dchild=1&keywords=Masks&qid=1594841003&sr=8-70,2020-07-15 15:23:30
